2025-12-19 06:31:59 [INFO] ================================================================================
2025-12-19 06:31:59 [INFO] DATA FETCHING STARTED
2025-12-19 06:31:59 [INFO] ================================================================================
2025-12-19 06:31:59 [INFO] Timestamp: 2025-12-19T06:31:59.631472
2025-12-19 06:31:59 [INFO] Candidates file: C:\Users\Roman\Documents\ASTRO\astro-llm\data\merged_candidates.json
2025-12-19 06:31:59 [INFO] Output file: data\stock_data.json
2025-12-19 06:31:59 [INFO] Skip news: False
2025-12-19 06:31:59 [INFO] Skip analyst: False
2025-12-19 06:31:59 [INFO] Delay: 0.5s
2025-12-19 06:31:59 [INFO] Resume mode: False
2025-12-19 06:31:59 [INFO] 
2025-12-19 06:31:59 [INFO] Fetching data for 65 tickers...
2025-12-19 06:31:59 [INFO] 
2025-12-19 06:31:59 [INFO] [1/65] Processing AAPL...
2025-12-19 06:31:59 [DEBUG] ⏱️  Started: AAPL:price_data
2025-12-19 06:32:02 [DEBUG] ✅ Completed: AAPL:price_data (took 2.13s)
2025-12-19 06:32:02 [DEBUG]   Price data: ✓ (2.13s)
2025-12-19 06:32:02 [DEBUG] ⏱️  Started: AAPL:fundamentals
2025-12-19 06:32:02 [DEBUG]   -> Fetching fundamentals from FMP API...
2025-12-19 06:32:07 [DEBUG] ✅ Completed: AAPL:fundamentals (took 4.72s)
2025-12-19 06:32:07 [DEBUG]   Fundamentals: ✓ (4.72s)
2025-12-19 06:32:07 [DEBUG] ⏱️  Started: AAPL:analyst
2025-12-19 06:32:10 [DEBUG] ✅ Completed: AAPL:analyst (took 2.84s)
2025-12-19 06:32:10 [DEBUG]   Analyst recs: ✓ (2.84s)
2025-12-19 06:32:11 [DEBUG] ⏱️  Started: AAPL:news
2025-12-19 06:32:11 [DEBUG] ✅ Completed: AAPL:news (took 0.65s)
2025-12-19 06:32:11 [DEBUG]   News: 10 items (0.65s)
2025-12-19 06:32:11 [DEBUG] ⏱️  Started: AAPL:sentiment
2025-12-19 06:32:14 [DEBUG] ✅ Completed: AAPL:sentiment (took 2.29s)
2025-12-19 06:32:14 [DEBUG]   Sentiment: 10 items classified (2.29s)
2025-12-19 06:32:15 [INFO]   Total time for AAPL: 15.14s
2025-12-19 06:32:15 [INFO] 
2025-12-19 06:32:15 [INFO] [2/65] Processing MSFT...
2025-12-19 06:32:15 [DEBUG] ⏱️  Started: MSFT:price_data
2025-12-19 06:32:17 [DEBUG] ✅ Completed: MSFT:price_data (took 1.90s)
2025-12-19 06:32:17 [DEBUG]   Price data: ✓ (1.90s)
2025-12-19 06:32:17 [DEBUG] ⏱️  Started: MSFT:fundamentals
2025-12-19 06:32:17 [DEBUG]   -> Fetching fundamentals from FMP API...
2025-12-19 06:32:23 [DEBUG] ✅ Completed: MSFT:fundamentals (took 5.90s)
2025-12-19 06:32:23 [DEBUG]   Fundamentals: ✓ (5.90s)
2025-12-19 06:32:23 [DEBUG] ⏱️  Started: MSFT:analyst
2025-12-19 06:32:26 [DEBUG] ✅ Completed: MSFT:analyst (took 2.41s)
2025-12-19 06:32:26 [DEBUG]   Analyst recs: ✓ (2.41s)
2025-12-19 06:32:26 [DEBUG] ⏱️  Started: MSFT:news
2025-12-19 06:32:27 [DEBUG] ✅ Completed: MSFT:news (took 0.63s)
2025-12-19 06:32:27 [DEBUG]   News: 10 items (0.63s)
2025-12-19 06:32:27 [DEBUG] ⏱️  Started: MSFT:sentiment
2025-12-19 06:32:28 [DEBUG] ✅ Completed: MSFT:sentiment (took 1.29s)
2025-12-19 06:32:28 [DEBUG]   Sentiment: 10 items classified (1.29s)
2025-12-19 06:32:29 [INFO]   Total time for MSFT: 14.64s
2025-12-19 06:32:29 [INFO] 
2025-12-19 06:32:29 [INFO] [3/65] Processing AMZN...
2025-12-19 06:32:29 [DEBUG] ⏱️  Started: AMZN:price_data
2025-12-19 06:32:31 [DEBUG] ✅ Completed: AMZN:price_data (took 2.14s)
2025-12-19 06:32:31 [DEBUG]   Price data: ✓ (2.14s)
2025-12-19 06:32:32 [DEBUG] ⏱️  Started: AMZN:fundamentals
2025-12-19 06:32:32 [DEBUG]   -> Fetching fundamentals from FMP API...
2025-12-19 06:32:36 [DEBUG] ✅ Completed: AMZN:fundamentals (took 4.32s)
2025-12-19 06:32:36 [DEBUG]   Fundamentals: ✓ (4.32s)
2025-12-19 06:32:37 [DEBUG] ⏱️  Started: AMZN:analyst
2025-12-19 06:32:39 [DEBUG] ✅ Completed: AMZN:analyst (took 2.70s)
2025-12-19 06:32:39 [DEBUG]   Analyst recs: ✓ (2.70s)
2025-12-19 06:32:40 [DEBUG] ⏱️  Started: AMZN:news
2025-12-19 06:32:40 [DEBUG] ✅ Completed: AMZN:news (took 0.58s)
2025-12-19 06:32:40 [DEBUG]   News: 10 items (0.58s)
2025-12-19 06:32:40 [DEBUG] ⏱️  Started: AMZN:sentiment
2025-12-19 06:32:42 [DEBUG] ✅ Completed: AMZN:sentiment (took 1.33s)
2025-12-19 06:32:42 [DEBUG]   Sentiment: 10 items classified (1.33s)
2025-12-19 06:32:43 [INFO]   Total time for AMZN: 13.57s
2025-12-19 06:32:43 [INFO] 
2025-12-19 06:32:43 [INFO] [4/65] Processing GOOGL...
2025-12-19 06:32:43 [DEBUG] ⏱️  Started: GOOGL:price_data
2025-12-19 06:32:45 [DEBUG] ✅ Completed: GOOGL:price_data (took 2.04s)
2025-12-19 06:32:45 [DEBUG]   Price data: ✓ (2.04s)
2025-12-19 06:32:45 [DEBUG] ⏱️  Started: GOOGL:fundamentals
2025-12-19 06:32:45 [DEBUG]   -> Fetching fundamentals from FMP API...
2025-12-19 06:32:50 [DEBUG] ✅ Completed: GOOGL:fundamentals (took 4.35s)
2025-12-19 06:32:50 [DEBUG]   Fundamentals: ✓ (4.35s)
2025-12-19 06:32:50 [DEBUG] ⏱️  Started: GOOGL:analyst
2025-12-19 06:32:53 [DEBUG] ✅ Completed: GOOGL:analyst (took 2.54s)
2025-12-19 06:32:53 [DEBUG]   Analyst recs: ✓ (2.54s)
2025-12-19 06:32:53 [DEBUG] ⏱️  Started: GOOGL:news
2025-12-19 06:32:54 [DEBUG] ✅ Completed: GOOGL:news (took 0.63s)
2025-12-19 06:32:54 [DEBUG]   News: 10 items (0.63s)
2025-12-19 06:32:54 [DEBUG] ⏱️  Started: GOOGL:sentiment
2025-12-19 06:32:56 [DEBUG] ✅ Completed: GOOGL:sentiment (took 1.82s)
2025-12-19 06:32:56 [DEBUG]   Sentiment: 10 items classified (1.82s)
2025-12-19 06:32:57 [INFO]   Total time for GOOGL: 13.90s
2025-12-19 06:32:57 [INFO] 
2025-12-19 06:32:57 [INFO] [5/65] Processing FB...
2025-12-19 06:32:57 [DEBUG] ⏱️  Started: FB:price_data
2025-12-19 06:32:59 [DEBUG] ✅ Completed: FB:price_data (took 2.01s)
2025-12-19 06:32:59 [DEBUG]   Price data: ✓ (2.01s)
2025-12-19 06:32:59 [DEBUG] ⏱️  Started: FB:fundamentals
2025-12-19 06:32:59 [DEBUG]   -> Fetching fundamentals from FMP API...
2025-12-19 06:33:04 [DEBUG] ✅ Completed: FB:fundamentals (took 4.49s)
2025-12-19 06:33:04 [DEBUG]   Fundamentals: ✓ (4.49s)
2025-12-19 06:33:04 [DEBUG] ⏱️  Started: FB:analyst
2025-12-19 06:33:10 [DEBUG] ✅ Completed: FB:analyst (took 5.93s)
2025-12-19 06:33:10 [DEBUG]   Analyst recs: ✓ (5.93s)
2025-12-19 06:33:11 [DEBUG] ⏱️  Started: FB:news
2025-12-19 06:33:14 [DEBUG] ✅ Completed: FB:news (took 2.94s)
2025-12-19 06:33:14 [DEBUG]   News: 4 items (2.94s)
2025-12-19 06:33:14 [DEBUG] ⏱️  Started: FB:sentiment
2025-12-19 06:33:14 [DEBUG] ✅ Completed: FB:sentiment (took 0.72s)
2025-12-19 06:33:14 [DEBUG]   Sentiment: 4 items classified (0.72s)
2025-12-19 06:33:15 [INFO]   Total time for FB: 18.60s
2025-12-19 06:33:15 [INFO] 
2025-12-19 06:33:15 [INFO] [6/65] Processing TSLA...
2025-12-19 06:33:15 [DEBUG] ⏱️  Started: TSLA:price_data
2025-12-19 06:33:17 [DEBUG] ✅ Completed: TSLA:price_data (took 1.77s)
2025-12-19 06:33:17 [DEBUG]   Price data: ✓ (1.77s)
2025-12-19 06:33:18 [DEBUG] ⏱️  Started: TSLA:fundamentals
2025-12-19 06:33:18 [DEBUG]   -> Fetching fundamentals from FMP API...
2025-12-19 06:33:22 [DEBUG] ✅ Completed: TSLA:fundamentals (took 4.58s)
2025-12-19 06:33:22 [DEBUG]   Fundamentals: ✓ (4.58s)
2025-12-19 06:33:23 [DEBUG] ⏱️  Started: TSLA:analyst
2025-12-19 06:33:25 [DEBUG] ✅ Completed: TSLA:analyst (took 2.66s)
2025-12-19 06:33:25 [DEBUG]   Analyst recs: ✓ (2.66s)
2025-12-19 06:33:26 [DEBUG] ⏱️  Started: TSLA:news
2025-12-19 06:33:27 [DEBUG] ✅ Completed: TSLA:news (took 0.78s)
2025-12-19 06:33:27 [DEBUG]   News: 10 items (0.78s)
2025-12-19 06:33:27 [DEBUG] ⏱️  Started: TSLA:sentiment
2025-12-19 06:33:28 [DEBUG] ✅ Completed: TSLA:sentiment (took 1.46s)
2025-12-19 06:33:28 [DEBUG]   Sentiment: 10 items classified (1.46s)
2025-12-19 06:33:29 [INFO]   Total time for TSLA: 13.76s
2025-12-19 06:33:29 [INFO] 
2025-12-19 06:33:29 [INFO] [7/65] Processing NVDA...
2025-12-19 06:33:29 [DEBUG] ⏱️  Started: NVDA:price_data
2025-12-19 06:33:31 [DEBUG] ✅ Completed: NVDA:price_data (took 2.15s)
2025-12-19 06:33:31 [DEBUG]   Price data: ✓ (2.15s)
2025-12-19 06:33:32 [DEBUG] ⏱️  Started: NVDA:fundamentals
2025-12-19 06:33:32 [DEBUG]   -> Fetching fundamentals from FMP API...
2025-12-19 06:33:36 [DEBUG] ✅ Completed: NVDA:fundamentals (took 4.55s)
2025-12-19 06:33:36 [DEBUG]   Fundamentals: ✓ (4.55s)
2025-12-19 06:33:37 [DEBUG] ⏱️  Started: NVDA:analyst
2025-12-19 06:33:39 [DEBUG] ✅ Completed: NVDA:analyst (took 2.50s)
2025-12-19 06:33:39 [DEBUG]   Analyst recs: ✓ (2.50s)
2025-12-19 06:33:40 [DEBUG] ⏱️  Started: NVDA:news
2025-12-19 06:33:41 [DEBUG] ✅ Completed: NVDA:news (took 0.72s)
2025-12-19 06:33:41 [DEBUG]   News: 10 items (0.72s)
2025-12-19 06:33:41 [DEBUG] ⏱️  Started: NVDA:sentiment
2025-12-19 06:33:43 [DEBUG] ✅ Completed: NVDA:sentiment (took 2.22s)
2025-12-19 06:33:43 [DEBUG]   Sentiment: 10 items classified (2.22s)
2025-12-19 06:33:44 [INFO]   Total time for NVDA: 14.64s
2025-12-19 06:33:44 [INFO] 
2025-12-19 06:33:44 [INFO] [8/65] Processing BRK.B...
2025-12-19 06:33:44 [DEBUG] ⏱️  Started: BRK.B:price_data
2025-12-19 06:33:46 [DEBUG] ✅ Completed: BRK.B:price_data (took 1.87s)
2025-12-19 06:33:46 [DEBUG]   Price data: ✓ (1.87s)
2025-12-19 06:33:46 [DEBUG] ⏱️  Started: BRK.B:fundamentals
2025-12-19 06:33:46 [DEBUG]   -> Fetching fundamentals from FMP API...
2025-12-19 06:33:51 [DEBUG] ✅ Completed: BRK.B:fundamentals (took 4.44s)
2025-12-19 06:33:51 [DEBUG]   Fundamentals: ✓ (4.44s)
2025-12-19 06:33:51 [DEBUG] ⏱️  Started: BRK.B:analyst
2025-12-19 06:33:54 [DEBUG] ✅ Completed: BRK.B:analyst (took 2.68s)
2025-12-19 06:33:54 [DEBUG]   Analyst recs: ✓ (2.68s)
2025-12-19 06:33:54 [DEBUG] ⏱️  Started: BRK.B:news
2025-12-19 06:33:55 [DEBUG] ✅ Completed: BRK.B:news (took 0.70s)
2025-12-19 06:33:55 [DEBUG]   News: 10 items (0.70s)
2025-12-19 06:33:55 [DEBUG] ⏱️  Started: BRK.B:sentiment
2025-12-19 06:33:56 [DEBUG] ✅ Completed: BRK.B:sentiment (took 1.46s)
2025-12-19 06:33:56 [DEBUG]   Sentiment: 10 items classified (1.46s)
2025-12-19 06:33:57 [INFO]   Total time for BRK.B: 13.65s
2025-12-19 06:33:57 [INFO] 
2025-12-19 06:33:57 [INFO] [9/65] Processing JPM...
2025-12-19 06:33:57 [DEBUG] ⏱️  Started: JPM:price_data
2025-12-19 06:33:59 [DEBUG] ✅ Completed: JPM:price_data (took 1.96s)
2025-12-19 06:33:59 [DEBUG]   Price data: ✓ (1.96s)
2025-12-19 06:34:00 [DEBUG] ⏱️  Started: JPM:fundamentals
2025-12-19 06:34:00 [DEBUG]   -> Fetching fundamentals from FMP API...
2025-12-19 06:34:04 [DEBUG] ✅ Completed: JPM:fundamentals (took 4.43s)
2025-12-19 06:34:04 [DEBUG]   Fundamentals: ✓ (4.43s)
2025-12-19 06:34:05 [DEBUG] ⏱️  Started: JPM:analyst
2025-12-19 06:34:08 [DEBUG] ✅ Completed: JPM:analyst (took 2.82s)
2025-12-19 06:34:08 [DEBUG]   Analyst recs: ✓ (2.82s)
2025-12-19 06:34:08 [DEBUG] ⏱️  Started: JPM:news
2025-12-19 06:34:09 [DEBUG] ✅ Completed: JPM:news (took 0.75s)
2025-12-19 06:34:09 [DEBUG]   News: 10 items (0.75s)
2025-12-19 06:34:09 [DEBUG] ⏱️  Started: JPM:sentiment
2025-12-19 06:34:11 [DEBUG] ✅ Completed: JPM:sentiment (took 1.78s)
2025-12-19 06:34:11 [DEBUG]   Sentiment: 10 items classified (1.78s)
2025-12-19 06:34:12 [INFO]   Total time for JPM: 14.26s
2025-12-19 06:34:12 [INFO] 
2025-12-19 06:34:12 [INFO] [10/65] Processing V...
2025-12-19 06:34:12 [DEBUG] ⏱️  Started: V:price_data
2025-12-19 06:34:14 [DEBUG] ✅ Completed: V:price_data (took 2.04s)
2025-12-19 06:34:14 [DEBUG]   Price data: ✓ (2.04s)
2025-12-19 06:34:14 [DEBUG] ⏱️  Started: V:fundamentals
2025-12-19 06:34:14 [DEBUG]   -> Fetching fundamentals from FMP API...
2025-12-19 06:34:19 [DEBUG] ✅ Completed: V:fundamentals (took 4.44s)
2025-12-19 06:34:19 [DEBUG]   Fundamentals: ✓ (4.44s)
2025-12-19 06:34:19 [DEBUG] ⏱️  Started: V:analyst
2025-12-19 06:34:22 [DEBUG] ✅ Completed: V:analyst (took 2.73s)
2025-12-19 06:34:22 [DEBUG]   Analyst recs: ✓ (2.73s)
2025-12-19 06:34:22 [DEBUG] ⏱️  Started: V:news
2025-12-19 06:34:23 [DEBUG] ✅ Completed: V:news (took 0.63s)
2025-12-19 06:34:23 [DEBUG]   News: 10 items (0.63s)
2025-12-19 06:34:23 [DEBUG] ⏱️  Started: V:sentiment
2025-12-19 06:34:25 [DEBUG] ✅ Completed: V:sentiment (took 1.88s)
2025-12-19 06:34:25 [DEBUG]   Sentiment: 10 items classified (1.88s)
2025-12-19 06:34:26 [INFO]   Total time for V: 14.21s
2025-12-19 06:34:26 [INFO] 
2025-12-19 06:34:26 [INFO] [11/65] Processing MA...
2025-12-19 06:34:26 [DEBUG] ⏱️  Started: MA:price_data
2025-12-19 06:34:28 [DEBUG] ✅ Completed: MA:price_data (took 1.87s)
2025-12-19 06:34:28 [DEBUG]   Price data: ✓ (1.87s)
2025-12-19 06:34:28 [DEBUG] ⏱️  Started: MA:fundamentals
2025-12-19 06:34:28 [DEBUG]   -> Fetching fundamentals from FMP API...
2025-12-19 06:34:33 [DEBUG] ✅ Completed: MA:fundamentals (took 4.70s)
2025-12-19 06:34:33 [DEBUG]   Fundamentals: ✓ (4.70s)
2025-12-19 06:34:33 [DEBUG] ⏱️  Started: MA:analyst
2025-12-19 06:34:36 [DEBUG] ✅ Completed: MA:analyst (took 2.77s)
2025-12-19 06:34:36 [DEBUG]   Analyst recs: ✓ (2.77s)
2025-12-19 06:34:37 [DEBUG] ⏱️  Started: MA:news
2025-12-19 06:34:37 [DEBUG] ✅ Completed: MA:news (took 0.62s)
2025-12-19 06:34:37 [DEBUG]   News: 10 items (0.62s)
2025-12-19 06:34:37 [DEBUG] ⏱️  Started: MA:sentiment
2025-12-19 06:34:39 [DEBUG] ✅ Completed: MA:sentiment (took 1.54s)
2025-12-19 06:34:39 [DEBUG]   Sentiment: 10 items classified (1.54s)
2025-12-19 06:34:40 [INFO]   Total time for MA: 14.01s
2025-12-19 06:34:40 [INFO] 
2025-12-19 06:34:40 [INFO] [12/65] Processing DIS...
2025-12-19 06:34:40 [DEBUG] ⏱️  Started: DIS:price_data
2025-12-19 06:34:42 [DEBUG] ✅ Completed: DIS:price_data (took 1.89s)
2025-12-19 06:34:42 [DEBUG]   Price data: ✓ (1.89s)
2025-12-19 06:34:42 [DEBUG] ⏱️  Started: DIS:fundamentals
2025-12-19 06:34:42 [DEBUG]   -> Fetching fundamentals from FMP API...
2025-12-19 06:34:47 [DEBUG] ✅ Completed: DIS:fundamentals (took 4.37s)
2025-12-19 06:34:47 [DEBUG]   Fundamentals: ✓ (4.37s)
2025-12-19 06:34:47 [DEBUG] ⏱️  Started: DIS:analyst
2025-12-19 06:34:50 [DEBUG] ✅ Completed: DIS:analyst (took 2.68s)
2025-12-19 06:34:50 [DEBUG]   Analyst recs: ✓ (2.68s)
2025-12-19 06:34:50 [DEBUG] ⏱️  Started: DIS:news
2025-12-19 06:34:51 [DEBUG] ✅ Completed: DIS:news (took 0.64s)
2025-12-19 06:34:51 [DEBUG]   News: 10 items (0.64s)
2025-12-19 06:34:51 [DEBUG] ⏱️  Started: DIS:sentiment
2025-12-19 06:34:54 [DEBUG] ✅ Completed: DIS:sentiment (took 2.63s)
2025-12-19 06:34:54 [DEBUG]   Sentiment: 10 items classified (2.63s)
2025-12-19 06:34:55 [INFO]   Total time for DIS: 14.72s
2025-12-19 06:34:55 [INFO] 
2025-12-19 06:34:55 [INFO] [13/65] Processing NFLX...
2025-12-19 06:34:55 [DEBUG] ⏱️  Started: NFLX:price_data
2025-12-19 06:34:57 [DEBUG] ✅ Completed: NFLX:price_data (took 2.39s)
2025-12-19 06:34:57 [DEBUG]   Price data: ✓ (2.39s)
2025-12-19 06:34:57 [DEBUG] ⏱️  Started: NFLX:fundamentals
2025-12-19 06:34:57 [DEBUG]   -> Fetching fundamentals from FMP API...
2025-12-19 06:35:02 [DEBUG] ✅ Completed: NFLX:fundamentals (took 4.57s)
2025-12-19 06:35:02 [DEBUG]   Fundamentals: ✓ (4.57s)
2025-12-19 06:35:03 [DEBUG] ⏱️  Started: NFLX:analyst
2025-12-19 06:35:06 [DEBUG] ✅ Completed: NFLX:analyst (took 3.30s)
2025-12-19 06:35:06 [DEBUG]   Analyst recs: ✓ (3.30s)
2025-12-19 06:35:06 [DEBUG] ⏱️  Started: NFLX:news
2025-12-19 06:35:07 [DEBUG] ✅ Completed: NFLX:news (took 0.70s)
2025-12-19 06:35:07 [DEBUG]   News: 10 items (0.70s)
2025-12-19 06:35:07 [DEBUG] ⏱️  Started: NFLX:sentiment
2025-12-19 06:35:08 [DEBUG] ✅ Completed: NFLX:sentiment (took 1.43s)
2025-12-19 06:35:08 [DEBUG]   Sentiment: 10 items classified (1.43s)
2025-12-19 06:35:09 [INFO]   Total time for NFLX: 14.90s
2025-12-19 06:35:09 [INFO] 
2025-12-19 06:35:09 [INFO] [14/65] Processing PYPL...
2025-12-19 06:35:09 [DEBUG] ⏱️  Started: PYPL:price_data
2025-12-19 06:35:11 [DEBUG] ✅ Completed: PYPL:price_data (took 1.91s)
2025-12-19 06:35:11 [DEBUG]   Price data: ✓ (1.91s)
2025-12-19 06:35:12 [DEBUG] ⏱️  Started: PYPL:fundamentals
2025-12-19 06:35:12 [DEBUG]   -> Fetching fundamentals from FMP API...
2025-12-19 06:35:16 [DEBUG] ✅ Completed: PYPL:fundamentals (took 4.35s)
2025-12-19 06:35:16 [DEBUG]   Fundamentals: ✓ (4.35s)
2025-12-19 06:35:17 [DEBUG] ⏱️  Started: PYPL:analyst
2025-12-19 06:35:19 [DEBUG] ✅ Completed: PYPL:analyst (took 2.69s)
2025-12-19 06:35:19 [DEBUG]   Analyst recs: ✓ (2.69s)
2025-12-19 06:35:20 [DEBUG] ⏱️  Started: PYPL:news
2025-12-19 06:35:21 [DEBUG] ✅ Completed: PYPL:news (took 0.67s)
2025-12-19 06:35:21 [DEBUG]   News: 10 items (0.67s)
2025-12-19 06:35:21 [DEBUG] ⏱️  Started: PYPL:sentiment
2025-12-19 06:35:23 [DEBUG] ✅ Completed: PYPL:sentiment (took 1.95s)
2025-12-19 06:35:23 [DEBUG]   Sentiment: 10 items classified (1.95s)
2025-12-19 06:35:24 [INFO]   Total time for PYPL: 14.08s
2025-12-19 06:35:24 [INFO] 
2025-12-19 06:35:24 [INFO] [15/65] Processing CSCO...
2025-12-19 06:35:24 [DEBUG] ⏱️  Started: CSCO:price_data
2025-12-19 06:35:26 [DEBUG] ✅ Completed: CSCO:price_data (took 2.13s)
2025-12-19 06:35:26 [DEBUG]   Price data: ✓ (2.13s)
2025-12-19 06:35:26 [DEBUG] ⏱️  Started: CSCO:fundamentals
2025-12-19 06:35:26 [DEBUG]   -> Fetching fundamentals from FMP API...
2025-12-19 06:35:31 [DEBUG] ✅ Completed: CSCO:fundamentals (took 4.86s)
2025-12-19 06:35:31 [DEBUG]   Fundamentals: ✓ (4.86s)
2025-12-19 06:35:32 [DEBUG] ⏱️  Started: CSCO:analyst
2025-12-19 06:35:35 [DEBUG] ✅ Completed: CSCO:analyst (took 3.71s)
2025-12-19 06:35:35 [DEBUG]   Analyst recs: ✓ (3.71s)
2025-12-19 06:35:36 [DEBUG] ⏱️  Started: CSCO:news
2025-12-19 06:35:36 [DEBUG] ✅ Completed: CSCO:news (took 0.66s)
2025-12-19 06:35:36 [DEBUG]   News: 10 items (0.66s)
2025-12-19 06:35:36 [DEBUG] ⏱️  Started: CSCO:sentiment
2025-12-19 06:35:40 [DEBUG] ✅ Completed: CSCO:sentiment (took 3.08s)
2025-12-19 06:35:40 [DEBUG]   Sentiment: 10 items classified (3.08s)
2025-12-19 06:35:41 [INFO]   Total time for CSCO: 16.94s
2025-12-19 06:35:41 [INFO] 
2025-12-19 06:35:41 [INFO] [16/65] Processing PEP...
2025-12-19 06:35:41 [DEBUG] ⏱️  Started: PEP:price_data
2025-12-19 06:35:43 [DEBUG] ✅ Completed: PEP:price_data (took 2.04s)
2025-12-19 06:35:43 [DEBUG]   Price data: ✓ (2.04s)
2025-12-19 06:35:43 [DEBUG] ⏱️  Started: PEP:fundamentals
2025-12-19 06:35:43 [DEBUG]   -> Fetching fundamentals from FMP API...
2025-12-19 06:35:48 [DEBUG] ✅ Completed: PEP:fundamentals (took 4.45s)
2025-12-19 06:35:48 [DEBUG]   Fundamentals: ✓ (4.45s)
2025-12-19 06:35:48 [DEBUG] ⏱️  Started: PEP:analyst
2025-12-19 06:35:51 [DEBUG] ✅ Completed: PEP:analyst (took 2.64s)
2025-12-19 06:35:51 [DEBUG]   Analyst recs: ✓ (2.64s)
2025-12-19 06:35:51 [DEBUG] ⏱️  Started: PEP:news
2025-12-19 06:35:52 [DEBUG] ✅ Completed: PEP:news (took 0.63s)
2025-12-19 06:35:52 [DEBUG]   News: 10 items (0.63s)
2025-12-19 06:35:52 [DEBUG] ⏱️  Started: PEP:sentiment
2025-12-19 06:35:54 [DEBUG] ✅ Completed: PEP:sentiment (took 1.79s)
2025-12-19 06:35:54 [DEBUG]   Sentiment: 10 items classified (1.79s)
2025-12-19 06:35:55 [INFO]   Total time for PEP: 14.05s
2025-12-19 06:35:55 [INFO] 
2025-12-19 06:35:55 [INFO] [17/65] Processing KO...
2025-12-19 06:35:55 [DEBUG] ⏱️  Started: KO:price_data
2025-12-19 06:35:57 [DEBUG] ✅ Completed: KO:price_data (took 2.11s)
2025-12-19 06:35:57 [DEBUG]   Price data: ✓ (2.11s)
2025-12-19 06:35:57 [DEBUG] ⏱️  Started: KO:fundamentals
2025-12-19 06:35:57 [DEBUG]   -> Fetching fundamentals from FMP API...
2025-12-19 06:36:02 [DEBUG] ✅ Completed: KO:fundamentals (took 4.93s)
2025-12-19 06:36:02 [DEBUG]   Fundamentals: ✓ (4.93s)
2025-12-19 06:36:03 [DEBUG] ⏱️  Started: KO:analyst
2025-12-19 06:36:07 [DEBUG] ✅ Completed: KO:analyst (took 4.33s)
2025-12-19 06:36:07 [DEBUG]   Analyst recs: ✓ (4.33s)
2025-12-19 06:36:07 [DEBUG] ⏱️  Started: KO:news
2025-12-19 06:36:08 [DEBUG] ✅ Completed: KO:news (took 0.66s)
2025-12-19 06:36:08 [DEBUG]   News: 10 items (0.66s)
2025-12-19 06:36:08 [DEBUG] ⏱️  Started: KO:sentiment
2025-12-19 06:36:09 [DEBUG] ✅ Completed: KO:sentiment (took 1.29s)
2025-12-19 06:36:09 [DEBUG]   Sentiment: 10 items classified (1.29s)
2025-12-19 06:36:10 [INFO]   Total time for KO: 15.84s
2025-12-19 06:36:10 [INFO] 
2025-12-19 06:36:10 [INFO] [18/65] Processing WMT...
2025-12-19 06:36:10 [DEBUG] ⏱️  Started: WMT:price_data
2025-12-19 06:36:13 [DEBUG] ✅ Completed: WMT:price_data (took 2.18s)
2025-12-19 06:36:13 [DEBUG]   Price data: ✓ (2.18s)
2025-12-19 06:36:13 [DEBUG] ⏱️  Started: WMT:fundamentals
2025-12-19 06:36:13 [DEBUG]   -> Fetching fundamentals from FMP API...
2025-12-19 06:36:18 [DEBUG] ✅ Completed: WMT:fundamentals (took 4.70s)
2025-12-19 06:36:18 [DEBUG]   Fundamentals: ✓ (4.70s)
2025-12-19 06:36:18 [DEBUG] ⏱️  Started: WMT:analyst
2025-12-19 06:36:21 [DEBUG] ✅ Completed: WMT:analyst (took 2.64s)
2025-12-19 06:36:21 [DEBUG]   Analyst recs: ✓ (2.64s)
2025-12-19 06:36:21 [DEBUG] ⏱️  Started: WMT:news
2025-12-19 06:36:22 [DEBUG] ✅ Completed: WMT:news (took 0.85s)
2025-12-19 06:36:22 [DEBUG]   News: 10 items (0.85s)
2025-12-19 06:36:22 [DEBUG] ⏱️  Started: WMT:sentiment
2025-12-19 06:36:24 [DEBUG] ✅ Completed: WMT:sentiment (took 1.33s)
2025-12-19 06:36:24 [DEBUG]   Sentiment: 10 items classified (1.33s)
2025-12-19 06:36:25 [INFO]   Total time for WMT: 14.21s
2025-12-19 06:36:25 [INFO] 
2025-12-19 06:36:25 [INFO] [19/65] Processing COST...
2025-12-19 06:36:25 [DEBUG] ⏱️  Started: COST:price_data
2025-12-19 06:36:26 [DEBUG] ✅ Completed: COST:price_data (took 1.80s)
2025-12-19 06:36:26 [DEBUG]   Price data: ✓ (1.80s)
2025-12-19 06:36:27 [DEBUG] ⏱️  Started: COST:fundamentals
2025-12-19 06:36:27 [DEBUG]   -> Fetching fundamentals from FMP API...
2025-12-19 06:36:31 [DEBUG] ✅ Completed: COST:fundamentals (took 4.37s)
2025-12-19 06:36:31 [DEBUG]   Fundamentals: ✓ (4.37s)
2025-12-19 06:36:32 [DEBUG] ⏱️  Started: COST:analyst
2025-12-19 06:36:35 [DEBUG] ✅ Completed: COST:analyst (took 3.07s)
2025-12-19 06:36:35 [DEBUG]   Analyst recs: ✓ (3.07s)
2025-12-19 06:36:35 [DEBUG] ⏱️  Started: COST:news
2025-12-19 06:36:36 [DEBUG] ✅ Completed: COST:news (took 0.73s)
2025-12-19 06:36:36 [DEBUG]   News: 10 items (0.73s)
2025-12-19 06:36:36 [DEBUG] ⏱️  Started: COST:sentiment
2025-12-19 06:36:37 [DEBUG] ✅ Completed: COST:sentiment (took 1.24s)
2025-12-19 06:36:37 [DEBUG]   Sentiment: 10 items classified (1.24s)
2025-12-19 06:36:38 [INFO]   Total time for COST: 13.73s
2025-12-19 06:36:38 [INFO] 
2025-12-19 06:36:38 [INFO] [20/65] Processing T...
2025-12-19 06:36:38 [DEBUG] ⏱️  Started: T:price_data
2025-12-19 06:36:40 [DEBUG] ✅ Completed: T:price_data (took 1.95s)
2025-12-19 06:36:40 [DEBUG]   Price data: ✓ (1.95s)
2025-12-19 06:36:41 [DEBUG] ⏱️  Started: T:fundamentals
2025-12-19 06:36:41 [DEBUG]   -> Fetching fundamentals from FMP API...
2025-12-19 06:36:45 [DEBUG] ✅ Completed: T:fundamentals (took 4.47s)
2025-12-19 06:36:45 [DEBUG]   Fundamentals: ✓ (4.47s)
2025-12-19 06:36:46 [DEBUG] ⏱️  Started: T:analyst
2025-12-19 06:36:49 [DEBUG] ✅ Completed: T:analyst (took 2.95s)
2025-12-19 06:36:49 [DEBUG]   Analyst recs: ✓ (2.95s)
2025-12-19 06:36:49 [DEBUG] ⏱️  Started: T:news
2025-12-19 06:36:50 [DEBUG] ✅ Completed: T:news (took 0.61s)
2025-12-19 06:36:50 [DEBUG]   News: 10 items (0.61s)
2025-12-19 06:36:50 [DEBUG] ⏱️  Started: T:sentiment
2025-12-19 06:36:51 [DEBUG] ✅ Completed: T:sentiment (took 1.54s)
2025-12-19 06:36:51 [DEBUG]   Sentiment: 10 items classified (1.54s)
2025-12-19 06:36:52 [INFO]   Total time for T: 14.03s
2025-12-19 06:36:52 [INFO] 
2025-12-19 06:36:52 [INFO] [21/65] Processing VZ...
2025-12-19 06:36:52 [DEBUG] ⏱️  Started: VZ:price_data
2025-12-19 06:36:54 [DEBUG] ✅ Completed: VZ:price_data (took 2.03s)
2025-12-19 06:36:54 [DEBUG]   Price data: ✓ (2.03s)
2025-12-19 06:36:55 [DEBUG] ⏱️  Started: VZ:fundamentals
2025-12-19 06:36:55 [DEBUG]   -> Fetching fundamentals from FMP API...
2025-12-19 06:36:59 [DEBUG] ✅ Completed: VZ:fundamentals (took 4.28s)
2025-12-19 06:36:59 [DEBUG]   Fundamentals: ✓ (4.28s)
2025-12-19 06:37:00 [DEBUG] ⏱️  Started: VZ:analyst
2025-12-19 06:37:02 [DEBUG] ✅ Completed: VZ:analyst (took 2.76s)
2025-12-19 06:37:02 [DEBUG]   Analyst recs: ✓ (2.76s)
2025-12-19 06:37:03 [DEBUG] ⏱️  Started: VZ:news
2025-12-19 06:37:04 [DEBUG] ✅ Completed: VZ:news (took 0.66s)
2025-12-19 06:37:04 [DEBUG]   News: 10 items (0.66s)
2025-12-19 06:37:04 [DEBUG] ⏱️  Started: VZ:sentiment
2025-12-19 06:37:05 [DEBUG] ✅ Completed: VZ:sentiment (took 1.51s)
2025-12-19 06:37:05 [DEBUG]   Sentiment: 10 items classified (1.51s)
2025-12-19 06:37:06 [INFO]   Total time for VZ: 13.74s
2025-12-19 06:37:06 [INFO] 
2025-12-19 06:37:06 [INFO] [22/65] Processing XOM...
2025-12-19 06:37:06 [DEBUG] ⏱️  Started: XOM:price_data
2025-12-19 06:37:08 [DEBUG] ✅ Completed: XOM:price_data (took 1.98s)
2025-12-19 06:37:08 [DEBUG]   Price data: ✓ (1.98s)
2025-12-19 06:37:09 [DEBUG] ⏱️  Started: XOM:fundamentals
2025-12-19 06:37:09 [DEBUG]   -> Fetching fundamentals from FMP API...
2025-12-19 06:37:13 [DEBUG] ✅ Completed: XOM:fundamentals (took 4.45s)
2025-12-19 06:37:13 [DEBUG]   Fundamentals: ✓ (4.45s)
2025-12-19 06:37:14 [DEBUG] ⏱️  Started: XOM:analyst
2025-12-19 06:37:16 [DEBUG] ✅ Completed: XOM:analyst (took 2.73s)
2025-12-19 06:37:16 [DEBUG]   Analyst recs: ✓ (2.73s)
2025-12-19 06:37:17 [DEBUG] ⏱️  Started: XOM:news
2025-12-19 06:37:17 [DEBUG] ✅ Completed: XOM:news (took 0.67s)
2025-12-19 06:37:17 [DEBUG]   News: 10 items (0.67s)
2025-12-19 06:37:17 [DEBUG] ⏱️  Started: XOM:sentiment
2025-12-19 06:37:19 [DEBUG] ✅ Completed: XOM:sentiment (took 1.81s)
2025-12-19 06:37:19 [DEBUG]   Sentiment: 10 items classified (1.81s)
2025-12-19 06:37:20 [INFO]   Total time for XOM: 14.14s
2025-12-19 06:37:20 [INFO] 
2025-12-19 06:37:20 [INFO] [23/65] Processing CVX...
2025-12-19 06:37:20 [DEBUG] ⏱️  Started: CVX:price_data
2025-12-19 06:37:22 [DEBUG] ✅ Completed: CVX:price_data (took 2.05s)
2025-12-19 06:37:22 [DEBUG]   Price data: ✓ (2.05s)
2025-12-19 06:37:23 [DEBUG] ⏱️  Started: CVX:fundamentals
2025-12-19 06:37:23 [DEBUG]   -> Fetching fundamentals from FMP API...
2025-12-19 06:37:27 [DEBUG] ✅ Completed: CVX:fundamentals (took 4.35s)
2025-12-19 06:37:27 [DEBUG]   Fundamentals: ✓ (4.35s)
2025-12-19 06:37:28 [DEBUG] ⏱️  Started: CVX:analyst
2025-12-19 06:37:30 [DEBUG] ✅ Completed: CVX:analyst (took 2.66s)
2025-12-19 06:37:30 [DEBUG]   Analyst recs: ✓ (2.66s)
2025-12-19 06:37:31 [DEBUG] ⏱️  Started: CVX:news
2025-12-19 06:37:31 [DEBUG] ✅ Completed: CVX:news (took 0.64s)
2025-12-19 06:37:31 [DEBUG]   News: 10 items (0.64s)
2025-12-19 06:37:31 [DEBUG] ⏱️  Started: CVX:sentiment
2025-12-19 06:37:33 [DEBUG] ✅ Completed: CVX:sentiment (took 1.40s)
2025-12-19 06:37:33 [DEBUG]   Sentiment: 10 items classified (1.40s)
2025-12-19 06:37:34 [INFO]   Total time for CVX: 13.61s
2025-12-19 06:37:34 [INFO] 
2025-12-19 06:37:34 [INFO] [24/65] Processing PFE...
2025-12-19 06:37:34 [DEBUG] ⏱️  Started: PFE:price_data
2025-12-19 06:37:36 [DEBUG] ✅ Completed: PFE:price_data (took 2.50s)
2025-12-19 06:37:36 [DEBUG]   Price data: ✓ (2.50s)
2025-12-19 06:37:37 [DEBUG] ⏱️  Started: PFE:fundamentals
2025-12-19 06:37:37 [DEBUG]   -> Fetching fundamentals from FMP API...
2025-12-19 06:37:41 [DEBUG] ✅ Completed: PFE:fundamentals (took 4.44s)
2025-12-19 06:37:41 [DEBUG]   Fundamentals: ✓ (4.44s)
2025-12-19 06:37:42 [DEBUG] ⏱️  Started: PFE:analyst
2025-12-19 06:37:44 [DEBUG] ✅ Completed: PFE:analyst (took 2.43s)
2025-12-19 06:37:44 [DEBUG]   Analyst recs: ✓ (2.43s)
2025-12-19 06:37:45 [DEBUG] ⏱️  Started: PFE:news
2025-12-19 06:37:45 [DEBUG] ✅ Completed: PFE:news (took 0.71s)
2025-12-19 06:37:45 [DEBUG]   News: 10 items (0.71s)
2025-12-19 06:37:45 [DEBUG] ⏱️  Started: PFE:sentiment
2025-12-19 06:37:47 [DEBUG] ✅ Completed: PFE:sentiment (took 1.38s)
2025-12-19 06:37:47 [DEBUG]   Sentiment: 10 items classified (1.38s)
2025-12-19 06:37:48 [INFO]   Total time for PFE: 13.97s
2025-12-19 06:37:48 [INFO] 
2025-12-19 06:37:48 [INFO] [25/65] Processing JNJ...
2025-12-19 06:37:48 [DEBUG] ⏱️  Started: JNJ:price_data
2025-12-19 06:37:50 [DEBUG] ✅ Completed: JNJ:price_data (took 2.07s)
2025-12-19 06:37:50 [DEBUG]   Price data: ✓ (2.07s)
2025-12-19 06:37:50 [DEBUG] ⏱️  Started: JNJ:fundamentals
2025-12-19 06:37:50 [DEBUG]   -> Fetching fundamentals from FMP API...
2025-12-19 06:37:55 [DEBUG] ✅ Completed: JNJ:fundamentals (took 4.48s)
2025-12-19 06:37:55 [DEBUG]   Fundamentals: ✓ (4.48s)
2025-12-19 06:37:55 [DEBUG] ⏱️  Started: JNJ:analyst
2025-12-19 06:37:58 [DEBUG] ✅ Completed: JNJ:analyst (took 2.55s)
2025-12-19 06:37:58 [DEBUG]   Analyst recs: ✓ (2.55s)
2025-12-19 06:37:58 [DEBUG] ⏱️  Started: JNJ:news
2025-12-19 06:37:59 [DEBUG] ✅ Completed: JNJ:news (took 0.64s)
2025-12-19 06:37:59 [DEBUG]   News: 10 items (0.64s)
2025-12-19 06:37:59 [DEBUG] ⏱️  Started: JNJ:sentiment
2025-12-19 06:38:01 [DEBUG] ✅ Completed: JNJ:sentiment (took 2.10s)
2025-12-19 06:38:01 [DEBUG]   Sentiment: 10 items classified (2.10s)
2025-12-19 06:38:02 [INFO]   Total time for JNJ: 14.35s
2025-12-19 06:38:02 [INFO] 
2025-12-19 06:38:02 [INFO] [26/65] Processing MRK...
2025-12-19 06:38:02 [DEBUG] ⏱️  Started: MRK:price_data
2025-12-19 06:38:04 [DEBUG] ✅ Completed: MRK:price_data (took 2.25s)
2025-12-19 06:38:04 [DEBUG]   Price data: ✓ (2.25s)
2025-12-19 06:38:05 [DEBUG] ⏱️  Started: MRK:fundamentals
2025-12-19 06:38:05 [DEBUG]   -> Fetching fundamentals from FMP API...
2025-12-19 06:38:10 [DEBUG] ✅ Completed: MRK:fundamentals (took 4.82s)
2025-12-19 06:38:10 [DEBUG]   Fundamentals: ✓ (4.82s)
2025-12-19 06:38:10 [DEBUG] ⏱️  Started: MRK:analyst
2025-12-19 06:38:13 [DEBUG] ✅ Completed: MRK:analyst (took 2.61s)
2025-12-19 06:38:13 [DEBUG]   Analyst recs: ✓ (2.61s)
2025-12-19 06:38:13 [DEBUG] ⏱️  Started: MRK:news
2025-12-19 06:38:14 [DEBUG] ✅ Completed: MRK:news (took 0.67s)
2025-12-19 06:38:14 [DEBUG]   News: 10 items (0.67s)
2025-12-19 06:38:14 [DEBUG] ⏱️  Started: MRK:sentiment
2025-12-19 06:38:16 [DEBUG] ✅ Completed: MRK:sentiment (took 1.61s)
2025-12-19 06:38:16 [DEBUG]   Sentiment: 10 items classified (1.61s)
2025-12-19 06:38:17 [INFO]   Total time for MRK: 14.46s
2025-12-19 06:38:17 [INFO] 
2025-12-19 06:38:17 [INFO] [27/65] Processing ABT...
2025-12-19 06:38:17 [DEBUG] ⏱️  Started: ABT:price_data
2025-12-19 06:38:19 [DEBUG] ✅ Completed: ABT:price_data (took 1.91s)
2025-12-19 06:38:19 [DEBUG]   Price data: ✓ (1.91s)
2025-12-19 06:38:19 [DEBUG] ⏱️  Started: ABT:fundamentals
2025-12-19 06:38:19 [DEBUG]   -> Fetching fundamentals from FMP API...
2025-12-19 06:38:23 [DEBUG] ✅ Completed: ABT:fundamentals (took 4.39s)
2025-12-19 06:38:23 [DEBUG]   Fundamentals: ✓ (4.39s)
2025-12-19 06:38:24 [DEBUG] ⏱️  Started: ABT:analyst
2025-12-19 06:38:27 [DEBUG] ✅ Completed: ABT:analyst (took 2.66s)
2025-12-19 06:38:27 [DEBUG]   Analyst recs: ✓ (2.66s)
2025-12-19 06:38:27 [DEBUG] ⏱️  Started: ABT:news
2025-12-19 06:38:28 [DEBUG] ✅ Completed: ABT:news (took 0.63s)
2025-12-19 06:38:28 [DEBUG]   News: 10 items (0.63s)
2025-12-19 06:38:28 [DEBUG] ⏱️  Started: ABT:sentiment
2025-12-19 06:38:29 [DEBUG] ✅ Completed: ABT:sentiment (took 1.75s)
2025-12-19 06:38:29 [DEBUG]   Sentiment: 10 items classified (1.75s)
2025-12-19 06:38:30 [INFO]   Total time for ABT: 13.83s
2025-12-19 06:38:30 [INFO] 
2025-12-19 06:38:30 [INFO] [28/65] Processing NKE...
2025-12-19 06:38:30 [DEBUG] ⏱️  Started: NKE:price_data
2025-12-19 06:38:32 [DEBUG] ✅ Completed: NKE:price_data (took 1.94s)
2025-12-19 06:38:32 [DEBUG]   Price data: ✓ (1.94s)
2025-12-19 06:38:33 [DEBUG] ⏱️  Started: NKE:fundamentals
2025-12-19 06:38:33 [DEBUG]   -> Fetching fundamentals from FMP API...
2025-12-19 06:38:38 [DEBUG] ✅ Completed: NKE:fundamentals (took 4.69s)
2025-12-19 06:38:38 [DEBUG]   Fundamentals: ✓ (4.69s)
2025-12-19 06:38:38 [DEBUG] ⏱️  Started: NKE:analyst
2025-12-19 06:38:41 [DEBUG] ✅ Completed: NKE:analyst (took 2.95s)
2025-12-19 06:38:41 [DEBUG]   Analyst recs: ✓ (2.95s)
2025-12-19 06:38:42 [DEBUG] ⏱️  Started: NKE:news
2025-12-19 06:38:42 [DEBUG] ✅ Completed: NKE:news (took 0.70s)
2025-12-19 06:38:42 [DEBUG]   News: 10 items (0.70s)
2025-12-19 06:38:42 [DEBUG] ⏱️  Started: NKE:sentiment
2025-12-19 06:38:43 [DEBUG] ✅ Completed: NKE:sentiment (took 1.17s)
2025-12-19 06:38:43 [DEBUG]   Sentiment: 10 items classified (1.17s)
2025-12-19 06:38:44 [INFO]   Total time for NKE: 13.96s
2025-12-19 06:38:44 [INFO] 
2025-12-19 06:38:44 [INFO] [29/65] Processing LMT...
2025-12-19 06:38:44 [DEBUG] ⏱️  Started: LMT:price_data
2025-12-19 06:38:46 [DEBUG] ✅ Completed: LMT:price_data (took 1.79s)
2025-12-19 06:38:46 [DEBUG]   Price data: ✓ (1.79s)
2025-12-19 06:38:47 [DEBUG] ⏱️  Started: LMT:fundamentals
2025-12-19 06:38:47 [DEBUG]   -> Fetching fundamentals from FMP API...
2025-12-19 06:38:51 [DEBUG] ✅ Completed: LMT:fundamentals (took 4.24s)
2025-12-19 06:38:51 [DEBUG]   Fundamentals: ✓ (4.24s)
2025-12-19 06:38:51 [DEBUG] ⏱️  Started: LMT:analyst
2025-12-19 06:38:54 [DEBUG] ✅ Completed: LMT:analyst (took 2.72s)
2025-12-19 06:38:54 [DEBUG]   Analyst recs: ✓ (2.72s)
2025-12-19 06:38:55 [DEBUG] ⏱️  Started: LMT:news
2025-12-19 06:38:55 [DEBUG] ✅ Completed: LMT:news (took 0.67s)
2025-12-19 06:38:55 [DEBUG]   News: 10 items (0.67s)
2025-12-19 06:38:55 [DEBUG] ⏱️  Started: LMT:sentiment
2025-12-19 06:38:57 [DEBUG] ✅ Completed: LMT:sentiment (took 1.21s)
2025-12-19 06:38:57 [DEBUG]   Sentiment: 10 items classified (1.21s)
2025-12-19 06:38:58 [INFO]   Total time for LMT: 13.13s
2025-12-19 06:38:58 [INFO] 
2025-12-19 06:38:58 [INFO] [30/65] Processing BA...
2025-12-19 06:38:58 [DEBUG] ⏱️  Started: BA:price_data
2025-12-19 06:39:00 [DEBUG] ✅ Completed: BA:price_data (took 1.98s)
2025-12-19 06:39:00 [DEBUG]   Price data: ✓ (1.98s)
2025-12-19 06:39:00 [DEBUG] ⏱️  Started: BA:fundamentals
2025-12-19 06:39:00 [DEBUG]   -> Fetching fundamentals from FMP API...
2025-12-19 06:39:05 [DEBUG] ✅ Completed: BA:fundamentals (took 4.59s)
2025-12-19 06:39:05 [DEBUG]   Fundamentals: ✓ (4.59s)
2025-12-19 06:39:05 [DEBUG] ⏱️  Started: BA:analyst
2025-12-19 06:39:09 [DEBUG] ✅ Completed: BA:analyst (took 3.75s)
2025-12-19 06:39:09 [DEBUG]   Analyst recs: ✓ (3.75s)
2025-12-19 06:39:09 [DEBUG] ⏱️  Started: BA:news
2025-12-19 06:39:10 [DEBUG] ✅ Completed: BA:news (took 0.64s)
2025-12-19 06:39:10 [DEBUG]   News: 10 items (0.64s)
2025-12-19 06:39:10 [DEBUG] ⏱️  Started: BA:sentiment
2025-12-19 06:39:11 [DEBUG] ✅ Completed: BA:sentiment (took 1.25s)
2025-12-19 06:39:11 [DEBUG]   Sentiment: 10 items classified (1.25s)
2025-12-19 06:39:12 [INFO]   Total time for BA: 14.71s
2025-12-19 06:39:12 [INFO] 
2025-12-19 06:39:12 [INFO] [31/65] Processing CAT...
2025-12-19 06:39:12 [DEBUG] ⏱️  Started: CAT:price_data
2025-12-19 06:39:14 [DEBUG] ✅ Completed: CAT:price_data (took 1.93s)
2025-12-19 06:39:14 [DEBUG]   Price data: ✓ (1.93s)
2025-12-19 06:39:15 [DEBUG] ⏱️  Started: CAT:fundamentals
2025-12-19 06:39:15 [DEBUG]   -> Fetching fundamentals from FMP API...
2025-12-19 06:39:20 [DEBUG] ✅ Completed: CAT:fundamentals (took 4.82s)
2025-12-19 06:39:20 [DEBUG]   Fundamentals: ✓ (4.82s)
2025-12-19 06:39:20 [DEBUG] ⏱️  Started: CAT:analyst
2025-12-19 06:39:23 [DEBUG] ✅ Completed: CAT:analyst (took 2.80s)
2025-12-19 06:39:23 [DEBUG]   Analyst recs: ✓ (2.80s)
2025-12-19 06:39:23 [DEBUG] ⏱️  Started: CAT:news
2025-12-19 06:39:24 [DEBUG] ✅ Completed: CAT:news (took 0.65s)
2025-12-19 06:39:24 [DEBUG]   News: 10 items (0.65s)
2025-12-19 06:39:24 [DEBUG] ⏱️  Started: CAT:sentiment
2025-12-19 06:39:26 [DEBUG] ✅ Completed: CAT:sentiment (took 1.55s)
2025-12-19 06:39:26 [DEBUG]   Sentiment: 10 items classified (1.55s)
2025-12-19 06:39:27 [INFO]   Total time for CAT: 14.26s
2025-12-19 06:39:27 [INFO] 
2025-12-19 06:39:27 [INFO] [32/65] Processing MMM...
2025-12-19 06:39:27 [DEBUG] ⏱️  Started: MMM:price_data
2025-12-19 06:39:29 [DEBUG] ✅ Completed: MMM:price_data (took 1.96s)
2025-12-19 06:39:29 [DEBUG]   Price data: ✓ (1.96s)
2025-12-19 06:39:29 [DEBUG] ⏱️  Started: MMM:fundamentals
2025-12-19 06:39:29 [DEBUG]   -> Fetching fundamentals from FMP API...
2025-12-19 06:39:34 [DEBUG] ✅ Completed: MMM:fundamentals (took 4.63s)
2025-12-19 06:39:34 [DEBUG]   Fundamentals: ✓ (4.63s)
2025-12-19 06:39:34 [DEBUG] ⏱️  Started: MMM:analyst
2025-12-19 06:39:37 [DEBUG] ✅ Completed: MMM:analyst (took 2.80s)
2025-12-19 06:39:37 [DEBUG]   Analyst recs: ✓ (2.80s)
2025-12-19 06:39:37 [DEBUG] ⏱️  Started: MMM:news
2025-12-19 06:39:38 [DEBUG] ✅ Completed: MMM:news (took 0.68s)
2025-12-19 06:39:38 [DEBUG]   News: 10 items (0.68s)
2025-12-19 06:39:38 [DEBUG] ⏱️  Started: MMM:sentiment
2025-12-19 06:39:39 [DEBUG] ✅ Completed: MMM:sentiment (took 1.25s)
2025-12-19 06:39:39 [DEBUG]   Sentiment: 10 items classified (1.25s)
2025-12-19 06:39:40 [INFO]   Total time for MMM: 13.84s
2025-12-19 06:39:40 [INFO] 
2025-12-19 06:39:40 [INFO] [33/65] Processing HON...
2025-12-19 06:39:40 [DEBUG] ⏱️  Started: HON:price_data
2025-12-19 06:39:42 [DEBUG] ✅ Completed: HON:price_data (took 2.01s)
2025-12-19 06:39:42 [DEBUG]   Price data: ✓ (2.01s)
2025-12-19 06:39:43 [DEBUG] ⏱️  Started: HON:fundamentals
2025-12-19 06:39:43 [DEBUG]   -> Fetching fundamentals from FMP API...
2025-12-19 06:39:47 [DEBUG] ✅ Completed: HON:fundamentals (took 4.40s)
2025-12-19 06:39:47 [DEBUG]   Fundamentals: ✓ (4.40s)
2025-12-19 06:39:48 [DEBUG] ⏱️  Started: HON:analyst
2025-12-19 06:39:51 [DEBUG] ✅ Completed: HON:analyst (took 2.72s)
2025-12-19 06:39:51 [DEBUG]   Analyst recs: ✓ (2.72s)
2025-12-19 06:39:51 [DEBUG] ⏱️  Started: HON:news
2025-12-19 06:39:52 [DEBUG] ✅ Completed: HON:news (took 0.67s)
2025-12-19 06:39:52 [DEBUG]   News: 10 items (0.67s)
2025-12-19 06:39:52 [DEBUG] ⏱️  Started: HON:sentiment
2025-12-19 06:39:54 [DEBUG] ✅ Completed: HON:sentiment (took 2.00s)
2025-12-19 06:39:54 [DEBUG]   Sentiment: 10 items classified (2.00s)
2025-12-19 06:39:55 [INFO]   Total time for HON: 14.31s
2025-12-19 06:39:55 [INFO] 
2025-12-19 06:39:55 [INFO] [34/65] Processing UPS...
2025-12-19 06:39:55 [DEBUG] ⏱️  Started: UPS:price_data
2025-12-19 06:39:57 [DEBUG] ✅ Completed: UPS:price_data (took 1.98s)
2025-12-19 06:39:57 [DEBUG]   Price data: ✓ (1.98s)
2025-12-19 06:39:57 [DEBUG] ⏱️  Started: UPS:fundamentals
2025-12-19 06:39:57 [DEBUG]   -> Fetching fundamentals from FMP API...
2025-12-19 06:40:02 [DEBUG] ✅ Completed: UPS:fundamentals (took 4.57s)
2025-12-19 06:40:02 [DEBUG]   Fundamentals: ✓ (4.57s)
2025-12-19 06:40:02 [DEBUG] ⏱️  Started: UPS:analyst
2025-12-19 06:40:05 [DEBUG] ✅ Completed: UPS:analyst (took 2.45s)
2025-12-19 06:40:05 [DEBUG]   Analyst recs: ✓ (2.45s)
2025-12-19 06:40:05 [DEBUG] ⏱️  Started: UPS:news
2025-12-19 06:40:06 [DEBUG] ✅ Completed: UPS:news (took 0.63s)
2025-12-19 06:40:06 [DEBUG]   News: 10 items (0.63s)
2025-12-19 06:40:06 [DEBUG] ⏱️  Started: UPS:sentiment
2025-12-19 06:40:09 [DEBUG] ✅ Completed: UPS:sentiment (took 2.90s)
2025-12-19 06:40:09 [DEBUG]   Sentiment: 10 items classified (2.90s)
2025-12-19 06:40:10 [INFO]   Total time for UPS: 15.04s
2025-12-19 06:40:10 [INFO] 
2025-12-19 06:40:10 [INFO] [35/65] Processing FDX...
2025-12-19 06:40:10 [DEBUG] ⏱️  Started: FDX:price_data
2025-12-19 06:40:12 [DEBUG] ✅ Completed: FDX:price_data (took 1.89s)
2025-12-19 06:40:12 [DEBUG]   Price data: ✓ (1.89s)
2025-12-19 06:40:12 [DEBUG] ⏱️  Started: FDX:fundamentals
2025-12-19 06:40:12 [DEBUG]   -> Fetching fundamentals from FMP API...
2025-12-19 06:40:17 [DEBUG] ✅ Completed: FDX:fundamentals (took 4.74s)
2025-12-19 06:40:17 [DEBUG]   Fundamentals: ✓ (4.74s)
2025-12-19 06:40:17 [DEBUG] ⏱️  Started: FDX:analyst
2025-12-19 06:40:20 [DEBUG] ✅ Completed: FDX:analyst (took 2.66s)
2025-12-19 06:40:20 [DEBUG]   Analyst recs: ✓ (2.66s)
2025-12-19 06:40:21 [DEBUG] ⏱️  Started: FDX:news
2025-12-19 06:40:21 [DEBUG] ✅ Completed: FDX:news (took 0.71s)
2025-12-19 06:40:21 [DEBUG]   News: 10 items (0.71s)
2025-12-19 06:40:21 [DEBUG] ⏱️  Started: FDX:sentiment
2025-12-19 06:40:23 [DEBUG] ✅ Completed: FDX:sentiment (took 1.76s)
2025-12-19 06:40:23 [DEBUG]   Sentiment: 10 items classified (1.76s)
2025-12-19 06:40:24 [INFO]   Total time for FDX: 14.27s
2025-12-19 06:40:24 [INFO] 
2025-12-19 06:40:24 [INFO] [36/65] Processing IBM...
2025-12-19 06:40:24 [DEBUG] ⏱️  Started: IBM:price_data
2025-12-19 06:40:26 [DEBUG] ✅ Completed: IBM:price_data (took 2.03s)
2025-12-19 06:40:26 [DEBUG]   Price data: ✓ (2.03s)
2025-12-19 06:40:27 [DEBUG] ⏱️  Started: IBM:fundamentals
2025-12-19 06:40:27 [DEBUG]   -> Fetching fundamentals from FMP API...
2025-12-19 06:40:32 [DEBUG] ✅ Completed: IBM:fundamentals (took 5.17s)
2025-12-19 06:40:32 [DEBUG]   Fundamentals: ✓ (5.17s)
2025-12-19 06:40:32 [DEBUG] ⏱️  Started: IBM:analyst
2025-12-19 06:40:35 [DEBUG] ✅ Completed: IBM:analyst (took 2.60s)
2025-12-19 06:40:35 [DEBUG]   Analyst recs: ✓ (2.60s)
2025-12-19 06:40:35 [DEBUG] ⏱️  Started: IBM:news
2025-12-19 06:40:36 [DEBUG] ✅ Completed: IBM:news (took 0.72s)
2025-12-19 06:40:36 [DEBUG]   News: 10 items (0.72s)
2025-12-19 06:40:36 [DEBUG] ⏱️  Started: IBM:sentiment
2025-12-19 06:40:38 [DEBUG] ✅ Completed: IBM:sentiment (took 1.51s)
2025-12-19 06:40:38 [DEBUG]   Sentiment: 10 items classified (1.51s)
2025-12-19 06:40:39 [INFO]   Total time for IBM: 14.54s
2025-12-19 06:40:39 [INFO] 
2025-12-19 06:40:39 [INFO] [37/65] Processing ADBE...
2025-12-19 06:40:39 [DEBUG] ⏱️  Started: ADBE:price_data
2025-12-19 06:40:41 [DEBUG] ✅ Completed: ADBE:price_data (took 2.06s)
2025-12-19 06:40:41 [DEBUG]   Price data: ✓ (2.06s)
2025-12-19 06:40:41 [DEBUG] ⏱️  Started: ADBE:fundamentals
2025-12-19 06:40:41 [DEBUG]   -> Fetching fundamentals from FMP API...
2025-12-19 06:40:47 [DEBUG] ✅ Completed: ADBE:fundamentals (took 5.46s)
2025-12-19 06:40:47 [DEBUG]   Fundamentals: ✓ (5.46s)
2025-12-19 06:40:47 [DEBUG] ⏱️  Started: ADBE:analyst
2025-12-19 06:40:50 [DEBUG] ✅ Completed: ADBE:analyst (took 2.66s)
2025-12-19 06:40:50 [DEBUG]   Analyst recs: ✓ (2.66s)
2025-12-19 06:40:50 [DEBUG] ⏱️  Started: ADBE:news
2025-12-19 06:40:51 [DEBUG] ✅ Completed: ADBE:news (took 0.65s)
2025-12-19 06:40:51 [DEBUG]   News: 10 items (0.65s)
2025-12-19 06:40:51 [DEBUG] ⏱️  Started: ADBE:sentiment
2025-12-19 06:40:52 [DEBUG] ✅ Completed: ADBE:sentiment (took 1.51s)
2025-12-19 06:40:52 [DEBUG]   Sentiment: 10 items classified (1.51s)
2025-12-19 06:40:53 [INFO]   Total time for ADBE: 14.85s
2025-12-19 06:40:53 [INFO] 
2025-12-19 06:40:53 [INFO] [38/65] Processing ORCL...
2025-12-19 06:40:53 [DEBUG] ⏱️  Started: ORCL:price_data
2025-12-19 06:40:55 [DEBUG] ✅ Completed: ORCL:price_data (took 1.68s)
2025-12-19 06:40:55 [DEBUG]   Price data: ✓ (1.68s)
2025-12-19 06:40:56 [DEBUG] ⏱️  Started: ORCL:fundamentals
2025-12-19 06:40:56 [DEBUG]   -> Fetching fundamentals from FMP API...
2025-12-19 06:41:00 [DEBUG] ✅ Completed: ORCL:fundamentals (took 4.38s)
2025-12-19 06:41:00 [DEBUG]   Fundamentals: ✓ (4.38s)
2025-12-19 06:41:00 [DEBUG] ⏱️  Started: ORCL:analyst
2025-12-19 06:41:03 [DEBUG] ✅ Completed: ORCL:analyst (took 2.78s)
2025-12-19 06:41:03 [DEBUG]   Analyst recs: ✓ (2.78s)
2025-12-19 06:41:04 [DEBUG] ⏱️  Started: ORCL:news
2025-12-19 06:41:04 [DEBUG] ✅ Completed: ORCL:news (took 0.70s)
2025-12-19 06:41:04 [DEBUG]   News: 10 items (0.70s)
2025-12-19 06:41:04 [DEBUG] ⏱️  Started: ORCL:sentiment
2025-12-19 06:41:06 [DEBUG] ✅ Completed: ORCL:sentiment (took 1.73s)
2025-12-19 06:41:06 [DEBUG]   Sentiment: 10 items classified (1.73s)
2025-12-19 06:41:07 [INFO]   Total time for ORCL: 13.78s
2025-12-19 06:41:07 [INFO] 
2025-12-19 06:41:07 [INFO] [39/65] Processing INTC...
2025-12-19 06:41:07 [DEBUG] ⏱️  Started: INTC:price_data
2025-12-19 06:41:09 [DEBUG] ✅ Completed: INTC:price_data (took 2.03s)
2025-12-19 06:41:09 [DEBUG]   Price data: ✓ (2.03s)
2025-12-19 06:41:10 [DEBUG] ⏱️  Started: INTC:fundamentals
2025-12-19 06:41:10 [DEBUG]   -> Fetching fundamentals from FMP API...
2025-12-19 06:41:14 [DEBUG] ✅ Completed: INTC:fundamentals (took 4.43s)
2025-12-19 06:41:14 [DEBUG]   Fundamentals: ✓ (4.43s)
2025-12-19 06:41:15 [DEBUG] ⏱️  Started: INTC:analyst
2025-12-19 06:41:17 [DEBUG] ✅ Completed: INTC:analyst (took 2.79s)
2025-12-19 06:41:17 [DEBUG]   Analyst recs: ✓ (2.79s)
2025-12-19 06:41:18 [DEBUG] ⏱️  Started: INTC:news
2025-12-19 06:41:19 [DEBUG] ✅ Completed: INTC:news (took 0.80s)
2025-12-19 06:41:19 [DEBUG]   News: 10 items (0.80s)
2025-12-19 06:41:19 [DEBUG] ⏱️  Started: INTC:sentiment
2025-12-19 06:41:20 [DEBUG] ✅ Completed: INTC:sentiment (took 1.18s)
2025-12-19 06:41:20 [DEBUG]   Sentiment: 10 items classified (1.18s)
2025-12-19 06:41:21 [INFO]   Total time for INTC: 13.73s
2025-12-19 06:41:21 [INFO] 
2025-12-19 06:41:21 [INFO] [40/65] Processing AMD...
2025-12-19 06:41:21 [DEBUG] ⏱️  Started: AMD:price_data
2025-12-19 06:41:23 [DEBUG] ✅ Completed: AMD:price_data (took 1.93s)
2025-12-19 06:41:23 [DEBUG]   Price data: ✓ (1.93s)
2025-12-19 06:41:23 [DEBUG] ⏱️  Started: AMD:fundamentals
2025-12-19 06:41:23 [DEBUG]   -> Fetching fundamentals from FMP API...
2025-12-19 06:41:28 [DEBUG] ✅ Completed: AMD:fundamentals (took 4.43s)
2025-12-19 06:41:28 [DEBUG]   Fundamentals: ✓ (4.43s)
2025-12-19 06:41:28 [DEBUG] ⏱️  Started: AMD:analyst
2025-12-19 06:41:31 [DEBUG] ✅ Completed: AMD:analyst (took 2.64s)
2025-12-19 06:41:31 [DEBUG]   Analyst recs: ✓ (2.64s)
2025-12-19 06:41:31 [DEBUG] ⏱️  Started: AMD:news
2025-12-19 06:41:32 [DEBUG] ✅ Completed: AMD:news (took 0.71s)
2025-12-19 06:41:32 [DEBUG]   News: 10 items (0.71s)
2025-12-19 06:41:32 [DEBUG] ⏱️  Started: AMD:sentiment
2025-12-19 06:41:34 [DEBUG] ✅ Completed: AMD:sentiment (took 1.68s)
2025-12-19 06:41:34 [DEBUG]   Sentiment: 10 items classified (1.68s)
2025-12-19 06:41:35 [INFO]   Total time for AMD: 13.90s
2025-12-19 06:41:35 [INFO] 
2025-12-19 06:41:35 [INFO] [41/65] Processing QCOM...
2025-12-19 06:41:35 [DEBUG] ⏱️  Started: QCOM:price_data
2025-12-19 06:41:37 [DEBUG] ✅ Completed: QCOM:price_data (took 1.96s)
2025-12-19 06:41:37 [DEBUG]   Price data: ✓ (1.96s)
2025-12-19 06:41:37 [DEBUG] ⏱️  Started: QCOM:fundamentals
2025-12-19 06:41:37 [DEBUG]   -> Fetching fundamentals from FMP API...
2025-12-19 06:41:42 [DEBUG] ✅ Completed: QCOM:fundamentals (took 4.37s)
2025-12-19 06:41:42 [DEBUG]   Fundamentals: ✓ (4.37s)
2025-12-19 06:41:42 [DEBUG] ⏱️  Started: QCOM:analyst
2025-12-19 06:41:45 [DEBUG] ✅ Completed: QCOM:analyst (took 2.64s)
2025-12-19 06:41:45 [DEBUG]   Analyst recs: ✓ (2.64s)
2025-12-19 06:41:45 [DEBUG] ⏱️  Started: QCOM:news
2025-12-19 06:41:46 [DEBUG] ✅ Completed: QCOM:news (took 0.64s)
2025-12-19 06:41:46 [DEBUG]   News: 10 items (0.64s)
2025-12-19 06:41:46 [DEBUG] ⏱️  Started: QCOM:sentiment
2025-12-19 06:41:47 [DEBUG] ✅ Completed: QCOM:sentiment (took 1.21s)
2025-12-19 06:41:47 [DEBUG]   Sentiment: 10 items classified (1.21s)
2025-12-19 06:41:48 [INFO]   Total time for QCOM: 13.32s
2025-12-19 06:41:48 [INFO] 
2025-12-19 06:41:48 [INFO] [42/65] Processing TXN...
2025-12-19 06:41:48 [DEBUG] ⏱️  Started: TXN:price_data
2025-12-19 06:41:50 [DEBUG] ✅ Completed: TXN:price_data (took 1.88s)
2025-12-19 06:41:50 [DEBUG]   Price data: ✓ (1.88s)
2025-12-19 06:41:51 [DEBUG] ⏱️  Started: TXN:fundamentals
2025-12-19 06:41:51 [DEBUG]   -> Fetching fundamentals from FMP API...
2025-12-19 06:41:55 [DEBUG] ✅ Completed: TXN:fundamentals (took 4.52s)
2025-12-19 06:41:55 [DEBUG]   Fundamentals: ✓ (4.52s)
2025-12-19 06:41:56 [DEBUG] ⏱️  Started: TXN:analyst
2025-12-19 06:41:59 [DEBUG] ✅ Completed: TXN:analyst (took 3.02s)
2025-12-19 06:41:59 [DEBUG]   Analyst recs: ✓ (3.02s)
2025-12-19 06:41:59 [DEBUG] ⏱️  Started: TXN:news
2025-12-19 06:42:00 [DEBUG] ✅ Completed: TXN:news (took 0.65s)
2025-12-19 06:42:00 [DEBUG]   News: 10 items (0.65s)
2025-12-19 06:42:00 [DEBUG] ⏱️  Started: TXN:sentiment
2025-12-19 06:42:02 [DEBUG] ✅ Completed: TXN:sentiment (took 1.90s)
2025-12-19 06:42:02 [DEBUG]   Sentiment: 10 items classified (1.90s)
2025-12-19 06:42:03 [INFO]   Total time for TXN: 14.50s
2025-12-19 06:42:03 [INFO] 
2025-12-19 06:42:03 [INFO] [43/65] Processing SBUX...
2025-12-19 06:42:03 [DEBUG] ⏱️  Started: SBUX:price_data
2025-12-19 06:42:05 [DEBUG] ✅ Completed: SBUX:price_data (took 2.00s)
2025-12-19 06:42:05 [DEBUG]   Price data: ✓ (2.00s)
2025-12-19 06:42:05 [DEBUG] ⏱️  Started: SBUX:fundamentals
2025-12-19 06:42:05 [DEBUG]   -> Fetching fundamentals from FMP API...
2025-12-19 06:42:10 [DEBUG] ✅ Completed: SBUX:fundamentals (took 4.96s)
2025-12-19 06:42:10 [DEBUG]   Fundamentals: ✓ (4.96s)
2025-12-19 06:42:11 [DEBUG] ⏱️  Started: SBUX:analyst
2025-12-19 06:42:13 [DEBUG] ✅ Completed: SBUX:analyst (took 2.67s)
2025-12-19 06:42:13 [DEBUG]   Analyst recs: ✓ (2.67s)
2025-12-19 06:42:14 [DEBUG] ⏱️  Started: SBUX:news
2025-12-19 06:42:14 [DEBUG] ✅ Completed: SBUX:news (took 0.65s)
2025-12-19 06:42:14 [DEBUG]   News: 10 items (0.65s)
2025-12-19 06:42:14 [DEBUG] ⏱️  Started: SBUX:sentiment
2025-12-19 06:42:17 [DEBUG] ✅ Completed: SBUX:sentiment (took 2.15s)
2025-12-19 06:42:17 [DEBUG]   Sentiment: 10 items classified (2.15s)
2025-12-19 06:42:18 [INFO]   Total time for SBUX: 14.93s
2025-12-19 06:42:18 [INFO] 
2025-12-19 06:42:18 [INFO] [44/65] Processing MCD...
2025-12-19 06:42:18 [DEBUG] ⏱️  Started: MCD:price_data
2025-12-19 06:42:20 [DEBUG] ✅ Completed: MCD:price_data (took 1.93s)
2025-12-19 06:42:20 [DEBUG]   Price data: ✓ (1.93s)
2025-12-19 06:42:20 [DEBUG] ⏱️  Started: MCD:fundamentals
2025-12-19 06:42:20 [DEBUG]   -> Fetching fundamentals from FMP API...
2025-12-19 06:42:25 [DEBUG] ✅ Completed: MCD:fundamentals (took 4.78s)
2025-12-19 06:42:25 [DEBUG]   Fundamentals: ✓ (4.78s)
2025-12-19 06:42:25 [DEBUG] ⏱️  Started: MCD:analyst
2025-12-19 06:42:29 [DEBUG] ✅ Completed: MCD:analyst (took 4.06s)
2025-12-19 06:42:29 [DEBUG]   Analyst recs: ✓ (4.06s)
2025-12-19 06:42:30 [DEBUG] ⏱️  Started: MCD:news
2025-12-19 06:42:30 [DEBUG] ✅ Completed: MCD:news (took 0.59s)
2025-12-19 06:42:30 [DEBUG]   News: 10 items (0.59s)
2025-12-19 06:42:30 [DEBUG] ⏱️  Started: MCD:sentiment
2025-12-19 06:42:32 [DEBUG] ✅ Completed: MCD:sentiment (took 1.84s)
2025-12-19 06:42:32 [DEBUG]   Sentiment: 10 items classified (1.84s)
2025-12-19 06:42:33 [INFO]   Total time for MCD: 15.72s
2025-12-19 06:42:33 [INFO] 
2025-12-19 06:42:33 [INFO] [45/65] Processing LRCX...
2025-12-19 06:42:33 [DEBUG] ⏱️  Started: LRCX:price_data
2025-12-19 06:42:35 [DEBUG] ✅ Completed: LRCX:price_data (took 1.87s)
2025-12-19 06:42:35 [DEBUG]   Price data: ✓ (1.87s)
2025-12-19 06:42:36 [DEBUG] ⏱️  Started: LRCX:fundamentals
2025-12-19 06:42:36 [DEBUG]   -> Fetching fundamentals from FMP API...
2025-12-19 06:42:40 [DEBUG] ✅ Completed: LRCX:fundamentals (took 4.74s)
2025-12-19 06:42:40 [DEBUG]   Fundamentals: ✓ (4.74s)
2025-12-19 06:42:41 [DEBUG] ⏱️  Started: LRCX:analyst
2025-12-19 06:42:43 [DEBUG] ✅ Completed: LRCX:analyst (took 2.50s)
2025-12-19 06:42:43 [DEBUG]   Analyst recs: ✓ (2.50s)
2025-12-19 06:42:44 [DEBUG] ⏱️  Started: LRCX:news
2025-12-19 06:42:44 [DEBUG] ✅ Completed: LRCX:news (took 0.58s)
2025-12-19 06:42:44 [DEBUG]   News: 10 items (0.58s)
2025-12-19 06:42:44 [DEBUG] ⏱️  Started: LRCX:sentiment
2025-12-19 06:42:47 [DEBUG] ✅ Completed: LRCX:sentiment (took 2.84s)
2025-12-19 06:42:47 [DEBUG]   Sentiment: 10 items classified (2.84s)
2025-12-19 06:42:48 [INFO]   Total time for LRCX: 15.04s
2025-12-19 06:42:48 [INFO] 
2025-12-19 06:42:48 [INFO] [46/65] Processing AMGN...
2025-12-19 06:42:48 [DEBUG] ⏱️  Started: AMGN:price_data
2025-12-19 06:42:50 [DEBUG] ✅ Completed: AMGN:price_data (took 1.83s)
2025-12-19 06:42:50 [DEBUG]   Price data: ✓ (1.83s)
2025-12-19 06:42:51 [DEBUG] ⏱️  Started: AMGN:fundamentals
2025-12-19 06:42:51 [DEBUG]   -> Fetching fundamentals from FMP API...
2025-12-19 06:42:55 [DEBUG] ✅ Completed: AMGN:fundamentals (took 4.39s)
2025-12-19 06:42:55 [DEBUG]   Fundamentals: ✓ (4.39s)
2025-12-19 06:42:56 [DEBUG] ⏱️  Started: AMGN:analyst
2025-12-19 06:42:58 [DEBUG] ✅ Completed: AMGN:analyst (took 2.54s)
2025-12-19 06:42:58 [DEBUG]   Analyst recs: ✓ (2.54s)
2025-12-19 06:42:59 [DEBUG] ⏱️  Started: AMGN:news
2025-12-19 06:42:59 [DEBUG] ✅ Completed: AMGN:news (took 0.64s)
2025-12-19 06:42:59 [DEBUG]   News: 10 items (0.64s)
2025-12-19 06:42:59 [DEBUG] ⏱️  Started: AMGN:sentiment
2025-12-19 06:43:00 [DEBUG] ✅ Completed: AMGN:sentiment (took 1.10s)
2025-12-19 06:43:00 [DEBUG]   Sentiment: 10 items classified (1.10s)
2025-12-19 06:43:01 [INFO]   Total time for AMGN: 13.00s
2025-12-19 06:43:01 [INFO] 
2025-12-19 06:43:01 [INFO] [47/65] Processing GILD...
2025-12-19 06:43:01 [DEBUG] ⏱️  Started: GILD:price_data
2025-12-19 06:43:04 [DEBUG] ✅ Completed: GILD:price_data (took 2.23s)
2025-12-19 06:43:04 [DEBUG]   Price data: ✓ (2.23s)
2025-12-19 06:43:04 [DEBUG] ⏱️  Started: GILD:fundamentals
2025-12-19 06:43:04 [DEBUG]   -> Fetching fundamentals from FMP API...
2025-12-19 06:43:09 [DEBUG] ✅ Completed: GILD:fundamentals (took 4.86s)
2025-12-19 06:43:09 [DEBUG]   Fundamentals: ✓ (4.86s)
2025-12-19 06:43:09 [DEBUG] ⏱️  Started: GILD:analyst
2025-12-19 06:43:12 [DEBUG] ✅ Completed: GILD:analyst (took 2.65s)
2025-12-19 06:43:12 [DEBUG]   Analyst recs: ✓ (2.65s)
2025-12-19 06:43:13 [DEBUG] ⏱️  Started: GILD:news
2025-12-19 06:43:13 [DEBUG] ✅ Completed: GILD:news (took 0.64s)
2025-12-19 06:43:13 [DEBUG]   News: 10 items (0.64s)
2025-12-19 06:43:13 [DEBUG] ⏱️  Started: GILD:sentiment
2025-12-19 06:43:14 [DEBUG] ✅ Completed: GILD:sentiment (took 0.89s)
2025-12-19 06:43:14 [DEBUG]   Sentiment: 10 items classified (0.89s)
2025-12-19 06:43:15 [INFO]   Total time for GILD: 13.80s
2025-12-19 06:43:15 [INFO] 
2025-12-19 06:43:15 [INFO] [48/65] Processing VRTX...
2025-12-19 06:43:15 [DEBUG] ⏱️  Started: VRTX:price_data
2025-12-19 06:43:17 [DEBUG] ✅ Completed: VRTX:price_data (took 1.88s)
2025-12-19 06:43:17 [DEBUG]   Price data: ✓ (1.88s)
2025-12-19 06:43:18 [DEBUG] ⏱️  Started: VRTX:fundamentals
2025-12-19 06:43:18 [DEBUG]   -> Fetching fundamentals from FMP API...
2025-12-19 06:43:22 [DEBUG] ✅ Completed: VRTX:fundamentals (took 4.70s)
2025-12-19 06:43:22 [DEBUG]   Fundamentals: ✓ (4.70s)
2025-12-19 06:43:23 [DEBUG] ⏱️  Started: VRTX:analyst
2025-12-19 06:43:25 [DEBUG] ✅ Completed: VRTX:analyst (took 2.57s)
2025-12-19 06:43:25 [DEBUG]   Analyst recs: ✓ (2.57s)
2025-12-19 06:43:26 [DEBUG] ⏱️  Started: VRTX:news
2025-12-19 06:43:26 [DEBUG] ✅ Completed: VRTX:news (took 0.62s)
2025-12-19 06:43:26 [DEBUG]   News: 10 items (0.62s)
2025-12-19 06:43:26 [DEBUG] ⏱️  Started: VRTX:sentiment
2025-12-19 06:43:29 [DEBUG] ✅ Completed: VRTX:sentiment (took 2.21s)
2025-12-19 06:43:29 [DEBUG]   Sentiment: 10 items classified (2.21s)
2025-12-19 06:43:30 [INFO]   Total time for VRTX: 14.49s
2025-12-19 06:43:30 [INFO] 
2025-12-19 06:43:30 [INFO] [49/65] Processing ISRG...
2025-12-19 06:43:30 [DEBUG] ⏱️  Started: ISRG:price_data
2025-12-19 06:43:32 [DEBUG] ✅ Completed: ISRG:price_data (took 1.94s)
2025-12-19 06:43:32 [DEBUG]   Price data: ✓ (1.94s)
2025-12-19 06:43:32 [DEBUG] ⏱️  Started: ISRG:fundamentals
2025-12-19 06:43:32 [DEBUG]   -> Fetching fundamentals from FMP API...
2025-12-19 06:43:37 [DEBUG] ✅ Completed: ISRG:fundamentals (took 4.57s)
2025-12-19 06:43:37 [DEBUG]   Fundamentals: ✓ (4.57s)
2025-12-19 06:43:37 [DEBUG] ⏱️  Started: ISRG:analyst
2025-12-19 06:43:40 [DEBUG] ✅ Completed: ISRG:analyst (took 3.05s)
2025-12-19 06:43:40 [DEBUG]   Analyst recs: ✓ (3.05s)
2025-12-19 06:43:41 [DEBUG] ⏱️  Started: ISRG:news
2025-12-19 06:43:41 [DEBUG] ✅ Completed: ISRG:news (took 0.58s)
2025-12-19 06:43:41 [DEBUG]   News: 10 items (0.58s)
2025-12-19 06:43:41 [DEBUG] ⏱️  Started: ISRG:sentiment
2025-12-19 06:43:42 [DEBUG] ✅ Completed: ISRG:sentiment (took 1.14s)
2025-12-19 06:43:42 [DEBUG]   Sentiment: 10 items classified (1.14s)
2025-12-19 06:43:43 [INFO]   Total time for ISRG: 13.79s
2025-12-19 06:43:43 [INFO] 
2025-12-19 06:43:43 [INFO] [50/65] Processing ZTS...
2025-12-19 06:43:43 [DEBUG] ⏱️  Started: ZTS:price_data
2025-12-19 06:43:45 [DEBUG] ✅ Completed: ZTS:price_data (took 1.93s)
2025-12-19 06:43:45 [DEBUG]   Price data: ✓ (1.93s)
2025-12-19 06:43:46 [DEBUG] ⏱️  Started: ZTS:fundamentals
2025-12-19 06:43:46 [DEBUG]   -> Fetching fundamentals from FMP API...
2025-12-19 06:43:50 [DEBUG] ✅ Completed: ZTS:fundamentals (took 4.44s)
2025-12-19 06:43:50 [DEBUG]   Fundamentals: ✓ (4.44s)
2025-12-19 06:43:51 [DEBUG] ⏱️  Started: ZTS:analyst
2025-12-19 06:43:54 [DEBUG] ✅ Completed: ZTS:analyst (took 2.76s)
2025-12-19 06:43:54 [DEBUG]   Analyst recs: ✓ (2.76s)
2025-12-19 06:43:54 [DEBUG] ⏱️  Started: ZTS:news
2025-12-19 06:43:55 [DEBUG] ✅ Completed: ZTS:news (took 0.68s)
2025-12-19 06:43:55 [DEBUG]   News: 10 items (0.68s)
2025-12-19 06:43:55 [DEBUG] ⏱️  Started: ZTS:sentiment
2025-12-19 06:43:56 [DEBUG] ✅ Completed: ZTS:sentiment (took 1.19s)
2025-12-19 06:43:56 [DEBUG]   Sentiment: 10 items classified (1.19s)
2025-12-19 06:43:57 [INFO]   Total time for ZTS: 13.51s
2025-12-19 06:43:57 [INFO] 
2025-12-19 06:43:57 [INFO] [51/65] Processing ADP...
2025-12-19 06:43:57 [DEBUG] ⏱️  Started: ADP:price_data
2025-12-19 06:43:59 [DEBUG] ✅ Completed: ADP:price_data (took 1.97s)
2025-12-19 06:43:59 [DEBUG]   Price data: ✓ (1.97s)
2025-12-19 06:43:59 [DEBUG] ⏱️  Started: ADP:fundamentals
2025-12-19 06:43:59 [DEBUG]   -> Fetching fundamentals from FMP API...
2025-12-19 06:44:04 [DEBUG] ✅ Completed: ADP:fundamentals (took 4.44s)
2025-12-19 06:44:04 [DEBUG]   Fundamentals: ✓ (4.44s)
2025-12-19 06:44:04 [DEBUG] ⏱️  Started: ADP:analyst
2025-12-19 06:44:07 [DEBUG] ✅ Completed: ADP:analyst (took 3.00s)
2025-12-19 06:44:07 [DEBUG]   Analyst recs: ✓ (3.00s)
2025-12-19 06:44:08 [DEBUG] ⏱️  Started: ADP:news
2025-12-19 06:44:09 [DEBUG] ✅ Completed: ADP:news (took 0.70s)
2025-12-19 06:44:09 [DEBUG]   News: 10 items (0.70s)
2025-12-19 06:44:09 [DEBUG] ⏱️  Started: ADP:sentiment
2025-12-19 06:44:10 [DEBUG] ✅ Completed: ADP:sentiment (took 1.57s)
2025-12-19 06:44:10 [DEBUG]   Sentiment: 10 items classified (1.57s)
2025-12-19 06:44:11 [INFO]   Total time for ADP: 14.20s
2025-12-19 06:44:11 [INFO] 
2025-12-19 06:44:11 [INFO] [52/65] Processing NOW...
2025-12-19 06:44:11 [DEBUG] ⏱️  Started: NOW:price_data
2025-12-19 06:44:13 [DEBUG] ✅ Completed: NOW:price_data (took 1.96s)
2025-12-19 06:44:13 [DEBUG]   Price data: ✓ (1.96s)
2025-12-19 06:44:14 [DEBUG] ⏱️  Started: NOW:fundamentals
2025-12-19 06:44:14 [DEBUG]   -> Fetching fundamentals from FMP API...
2025-12-19 06:44:18 [DEBUG] ✅ Completed: NOW:fundamentals (took 4.66s)
2025-12-19 06:44:18 [DEBUG]   Fundamentals: ✓ (4.66s)
2025-12-19 06:44:19 [DEBUG] ⏱️  Started: NOW:analyst
2025-12-19 06:44:22 [DEBUG] ✅ Completed: NOW:analyst (took 2.81s)
2025-12-19 06:44:22 [DEBUG]   Analyst recs: ✓ (2.81s)
2025-12-19 06:44:22 [DEBUG] ⏱️  Started: NOW:news
2025-12-19 06:44:23 [DEBUG] ✅ Completed: NOW:news (took 0.64s)
2025-12-19 06:44:23 [DEBUG]   News: 10 items (0.64s)
2025-12-19 06:44:23 [DEBUG] ⏱️  Started: NOW:sentiment
2025-12-19 06:44:24 [DEBUG] ✅ Completed: NOW:sentiment (took 1.40s)
2025-12-19 06:44:24 [DEBUG]   Sentiment: 10 items classified (1.40s)
2025-12-19 06:44:25 [INFO]   Total time for NOW: 13.98s
2025-12-19 06:44:25 [INFO] 
2025-12-19 06:44:25 [INFO] [53/65] Processing SNAP...
2025-12-19 06:44:25 [DEBUG] ⏱️  Started: SNAP:price_data
2025-12-19 06:44:27 [DEBUG] ✅ Completed: SNAP:price_data (took 2.03s)
2025-12-19 06:44:27 [DEBUG]   Price data: ✓ (2.03s)
2025-12-19 06:44:28 [DEBUG] ⏱️  Started: SNAP:fundamentals
2025-12-19 06:44:28 [DEBUG]   -> Fetching fundamentals from FMP API...
2025-12-19 06:44:32 [DEBUG] ✅ Completed: SNAP:fundamentals (took 4.45s)
2025-12-19 06:44:32 [DEBUG]   Fundamentals: ✓ (4.45s)
2025-12-19 06:44:33 [DEBUG] ⏱️  Started: SNAP:analyst
2025-12-19 06:44:36 [DEBUG] ✅ Completed: SNAP:analyst (took 2.95s)
2025-12-19 06:44:36 [DEBUG]   Analyst recs: ✓ (2.95s)
2025-12-19 06:44:36 [DEBUG] ⏱️  Started: SNAP:news
2025-12-19 06:44:37 [DEBUG] ✅ Completed: SNAP:news (took 0.67s)
2025-12-19 06:44:37 [DEBUG]   News: 10 items (0.67s)
2025-12-19 06:44:37 [DEBUG] ⏱️  Started: SNAP:sentiment
2025-12-19 06:44:39 [DEBUG] ✅ Completed: SNAP:sentiment (took 2.47s)
2025-12-19 06:44:39 [DEBUG]   Sentiment: 10 items classified (2.47s)
2025-12-19 06:44:40 [INFO]   Total time for SNAP: 15.07s
2025-12-19 06:44:40 [INFO] 
2025-12-19 06:44:40 [INFO] [54/65] Processing TWTR...
2025-12-19 06:44:40 [DEBUG] ⏱️  Started: TWTR:price_data
2025-12-19 06:44:42 [DEBUG] ✅ Completed: TWTR:price_data (took 2.04s)
2025-12-19 06:44:42 [DEBUG]   Price data: ✓ (2.04s)
2025-12-19 06:44:43 [DEBUG] ⏱️  Started: TWTR:fundamentals
2025-12-19 06:44:43 [DEBUG]   -> Fetching fundamentals from FMP API...
2025-12-19 06:44:47 [DEBUG] ✅ Completed: TWTR:fundamentals (took 4.29s)
2025-12-19 06:44:47 [DEBUG]   Fundamentals: ✓ (4.29s)
2025-12-19 06:44:48 [DEBUG] ⏱️  Started: TWTR:analyst
2025-12-19 06:44:50 [DEBUG] ✅ Completed: TWTR:analyst (took 2.49s)
2025-12-19 06:44:50 [DEBUG]   Analyst recs: ✓ (2.49s)
2025-12-19 06:44:51 [DEBUG] ⏱️  Started: TWTR:news
2025-12-19 06:44:54 [DEBUG] ✅ Completed: TWTR:news (took 3.25s)
2025-12-19 06:44:54 [DEBUG]   News: 0 items (3.25s)
2025-12-19 06:44:54 [INFO]   Total time for TWTR: 14.07s
2025-12-19 06:44:54 [INFO] 
2025-12-19 06:44:54 [INFO] [55/65] Processing ENPH...
2025-12-19 06:44:54 [DEBUG] ⏱️  Started: ENPH:price_data
2025-12-19 06:44:56 [DEBUG] ✅ Completed: ENPH:price_data (took 1.92s)
2025-12-19 06:44:56 [DEBUG]   Price data: ✓ (1.92s)
2025-12-19 06:44:57 [DEBUG] ⏱️  Started: ENPH:fundamentals
2025-12-19 06:44:57 [DEBUG]   -> Fetching fundamentals from FMP API...
2025-12-19 06:45:02 [DEBUG] ✅ Completed: ENPH:fundamentals (took 4.86s)
2025-12-19 06:45:02 [DEBUG]   Fundamentals: ✓ (4.86s)
2025-12-19 06:45:02 [DEBUG] ⏱️  Started: ENPH:analyst
2025-12-19 06:45:05 [DEBUG] ✅ Completed: ENPH:analyst (took 3.10s)
2025-12-19 06:45:05 [DEBUG]   Analyst recs: ✓ (3.10s)
2025-12-19 06:45:06 [DEBUG] ⏱️  Started: ENPH:news
2025-12-19 06:45:06 [DEBUG] ✅ Completed: ENPH:news (took 0.66s)
2025-12-19 06:45:06 [DEBUG]   News: 10 items (0.66s)
2025-12-19 06:45:06 [DEBUG] ⏱️  Started: ENPH:sentiment
2025-12-19 06:45:07 [DEBUG] ✅ Completed: ENPH:sentiment (took 1.17s)
2025-12-19 06:45:07 [DEBUG]   Sentiment: 10 items classified (1.17s)
2025-12-19 06:45:08 [INFO]   Total time for ENPH: 14.22s
2025-12-19 06:45:08 [INFO] 
2025-12-19 06:45:08 [INFO] [56/65] Processing NEE...
2025-12-19 06:45:08 [DEBUG] ⏱️  Started: NEE:price_data
2025-12-19 06:45:10 [DEBUG] ✅ Completed: NEE:price_data (took 1.79s)
2025-12-19 06:45:10 [DEBUG]   Price data: ✓ (1.79s)
2025-12-19 06:45:11 [DEBUG] ⏱️  Started: NEE:fundamentals
2025-12-19 06:45:11 [DEBUG]   -> Fetching fundamentals from FMP API...
2025-12-19 06:45:17 [DEBUG] ✅ Completed: NEE:fundamentals (took 5.94s)
2025-12-19 06:45:17 [DEBUG]   Fundamentals: ✓ (5.94s)
2025-12-19 06:45:17 [DEBUG] ⏱️  Started: NEE:analyst
2025-12-19 06:45:20 [DEBUG] ✅ Completed: NEE:analyst (took 2.77s)
2025-12-19 06:45:20 [DEBUG]   Analyst recs: ✓ (2.77s)
2025-12-19 06:45:20 [DEBUG] ⏱️  Started: NEE:news
2025-12-19 06:45:21 [DEBUG] ✅ Completed: NEE:news (took 0.65s)
2025-12-19 06:45:21 [DEBUG]   News: 10 items (0.65s)
2025-12-19 06:45:21 [DEBUG] ⏱️  Started: NEE:sentiment
2025-12-19 06:45:22 [DEBUG] ✅ Completed: NEE:sentiment (took 1.20s)
2025-12-19 06:45:22 [DEBUG]   Sentiment: 10 items classified (1.20s)
2025-12-19 06:45:23 [INFO]   Total time for NEE: 14.85s
2025-12-19 06:45:23 [INFO] 
2025-12-19 06:45:23 [INFO] [57/65] Processing FSLR...
2025-12-19 06:45:23 [DEBUG] ⏱️  Started: FSLR:price_data
2025-12-19 06:45:25 [DEBUG] ✅ Completed: FSLR:price_data (took 2.03s)
2025-12-19 06:45:25 [DEBUG]   Price data: ✓ (2.03s)
2025-12-19 06:45:26 [DEBUG] ⏱️  Started: FSLR:fundamentals
2025-12-19 06:45:26 [DEBUG]   -> Fetching fundamentals from FMP API...
2025-12-19 06:45:31 [DEBUG] ✅ Completed: FSLR:fundamentals (took 4.72s)
2025-12-19 06:45:31 [DEBUG]   Fundamentals: ✓ (4.72s)
2025-12-19 06:45:31 [DEBUG] ⏱️  Started: FSLR:analyst
2025-12-19 06:45:34 [DEBUG] ✅ Completed: FSLR:analyst (took 2.64s)
2025-12-19 06:45:34 [DEBUG]   Analyst recs: ✓ (2.64s)
2025-12-19 06:45:34 [DEBUG] ⏱️  Started: FSLR:news
2025-12-19 06:45:35 [DEBUG] ✅ Completed: FSLR:news (took 0.64s)
2025-12-19 06:45:35 [DEBUG]   News: 10 items (0.64s)
2025-12-19 06:45:35 [DEBUG] ⏱️  Started: FSLR:sentiment
2025-12-19 06:45:36 [DEBUG] ✅ Completed: FSLR:sentiment (took 1.57s)
2025-12-19 06:45:36 [DEBUG]   Sentiment: 10 items classified (1.57s)
2025-12-19 06:45:37 [INFO]   Total time for FSLR: 14.11s
2025-12-19 06:45:37 [INFO] 
2025-12-19 06:45:37 [INFO] [58/65] Processing REGN...
2025-12-19 06:45:37 [DEBUG] ⏱️  Started: REGN:price_data
2025-12-19 06:45:39 [DEBUG] ✅ Completed: REGN:price_data (took 1.75s)
2025-12-19 06:45:39 [DEBUG]   Price data: ✓ (1.75s)
2025-12-19 06:45:40 [DEBUG] ⏱️  Started: REGN:fundamentals
2025-12-19 06:45:40 [DEBUG]   -> Fetching fundamentals from FMP API...
2025-12-19 06:45:44 [DEBUG] ✅ Completed: REGN:fundamentals (took 4.29s)
2025-12-19 06:45:44 [DEBUG]   Fundamentals: ✓ (4.29s)
2025-12-19 06:45:44 [DEBUG] ⏱️  Started: REGN:analyst
2025-12-19 06:45:47 [DEBUG] ✅ Completed: REGN:analyst (took 2.79s)
2025-12-19 06:45:47 [DEBUG]   Analyst recs: ✓ (2.79s)
2025-12-19 06:45:48 [DEBUG] ⏱️  Started: REGN:news
2025-12-19 06:45:48 [DEBUG] ✅ Completed: REGN:news (took 0.63s)
2025-12-19 06:45:48 [DEBUG]   News: 10 items (0.63s)
2025-12-19 06:45:48 [DEBUG] ⏱️  Started: REGN:sentiment
2025-12-19 06:45:49 [DEBUG] ✅ Completed: REGN:sentiment (took 1.09s)
2025-12-19 06:45:49 [DEBUG]   Sentiment: 10 items classified (1.09s)
2025-12-19 06:45:50 [INFO]   Total time for REGN: 13.06s
2025-12-19 06:45:50 [INFO] 
2025-12-19 06:45:50 [INFO] [59/65] Processing ILMN...
2025-12-19 06:45:50 [DEBUG] ⏱️  Started: ILMN:price_data
2025-12-19 06:45:52 [DEBUG] ✅ Completed: ILMN:price_data (took 1.84s)
2025-12-19 06:45:52 [DEBUG]   Price data: ✓ (1.84s)
2025-12-19 06:45:53 [DEBUG] ⏱️  Started: ILMN:fundamentals
2025-12-19 06:45:53 [DEBUG]   -> Fetching fundamentals from FMP API...
2025-12-19 06:45:57 [DEBUG] ✅ Completed: ILMN:fundamentals (took 4.47s)
2025-12-19 06:45:57 [DEBUG]   Fundamentals: ✓ (4.47s)
2025-12-19 06:45:58 [DEBUG] ⏱️  Started: ILMN:analyst
2025-12-19 06:46:01 [DEBUG] ✅ Completed: ILMN:analyst (took 2.95s)
2025-12-19 06:46:01 [DEBUG]   Analyst recs: ✓ (2.95s)
2025-12-19 06:46:01 [DEBUG] ⏱️  Started: ILMN:news
2025-12-19 06:46:02 [DEBUG] ✅ Completed: ILMN:news (took 0.54s)
2025-12-19 06:46:02 [DEBUG]   News: 10 items (0.54s)
2025-12-19 06:46:02 [DEBUG] ⏱️  Started: ILMN:sentiment
2025-12-19 06:46:04 [DEBUG] ✅ Completed: ILMN:sentiment (took 1.78s)
2025-12-19 06:46:04 [DEBUG]   Sentiment: 10 items classified (1.78s)
2025-12-19 06:46:05 [INFO]   Total time for ILMN: 14.10s
2025-12-19 06:46:05 [INFO] 
2025-12-19 06:46:05 [INFO] [60/65] Processing CNC...
2025-12-19 06:46:05 [DEBUG] ⏱️  Started: CNC:price_data
2025-12-19 06:46:07 [DEBUG] ✅ Completed: CNC:price_data (took 2.11s)
2025-12-19 06:46:07 [DEBUG]   Price data: ✓ (2.11s)
2025-12-19 06:46:07 [DEBUG] ⏱️  Started: CNC:fundamentals
2025-12-19 06:46:07 [DEBUG]   -> Fetching fundamentals from FMP API...
2025-12-19 06:46:12 [DEBUG] ✅ Completed: CNC:fundamentals (took 4.92s)
2025-12-19 06:46:12 [DEBUG]   Fundamentals: ✓ (4.92s)
2025-12-19 06:46:13 [DEBUG] ⏱️  Started: CNC:analyst
2025-12-19 06:46:17 [DEBUG] ✅ Completed: CNC:analyst (took 3.97s)
2025-12-19 06:46:17 [DEBUG]   Analyst recs: ✓ (3.97s)
2025-12-19 06:46:17 [DEBUG] ⏱️  Started: CNC:news
2025-12-19 06:46:18 [DEBUG] ✅ Completed: CNC:news (took 0.64s)
2025-12-19 06:46:18 [DEBUG]   News: 10 items (0.64s)
2025-12-19 06:46:18 [DEBUG] ⏱️  Started: CNC:sentiment
2025-12-19 06:46:19 [DEBUG] ✅ Completed: CNC:sentiment (took 1.40s)
2025-12-19 06:46:19 [DEBUG]   Sentiment: 10 items classified (1.40s)
2025-12-19 06:46:20 [INFO]   Total time for CNC: 15.55s
2025-12-19 06:46:20 [INFO] 
2025-12-19 06:46:20 [INFO] [61/65] Processing FLR...
2025-12-19 06:46:20 [DEBUG] ⏱️  Started: FLR:price_data
2025-12-19 06:46:22 [DEBUG] ✅ Completed: FLR:price_data (took 2.02s)
2025-12-19 06:46:22 [DEBUG]   Price data: ✓ (2.02s)
2025-12-19 06:46:23 [DEBUG] ⏱️  Started: FLR:fundamentals
2025-12-19 06:46:23 [DEBUG]   -> Fetching fundamentals from FMP API...
2025-12-19 06:46:27 [DEBUG] ✅ Completed: FLR:fundamentals (took 4.59s)
2025-12-19 06:46:27 [DEBUG]   Fundamentals: ✓ (4.59s)
2025-12-19 06:46:28 [DEBUG] ⏱️  Started: FLR:analyst
2025-12-19 06:46:32 [DEBUG] ✅ Completed: FLR:analyst (took 3.98s)
2025-12-19 06:46:32 [DEBUG]   Analyst recs: ✓ (3.98s)
2025-12-19 06:46:32 [DEBUG] ⏱️  Started: FLR:news
2025-12-19 06:46:33 [DEBUG] ✅ Completed: FLR:news (took 0.63s)
2025-12-19 06:46:33 [DEBUG]   News: 10 items (0.63s)
2025-12-19 06:46:33 [DEBUG] ⏱️  Started: FLR:sentiment
2025-12-19 06:46:34 [DEBUG] ✅ Completed: FLR:sentiment (took 1.18s)
2025-12-19 06:46:34 [DEBUG]   Sentiment: 10 items classified (1.18s)
2025-12-19 06:46:35 [INFO]   Total time for FLR: 14.91s
2025-12-19 06:46:35 [INFO] 
2025-12-19 06:46:35 [INFO] [62/65] Processing JEC...
2025-12-19 06:46:35 [DEBUG] ⏱️  Started: JEC:price_data
2025-12-19 06:46:37 [DEBUG] ✅ Completed: JEC:price_data (took 2.12s)
2025-12-19 06:46:37 [DEBUG]   Price data: ✓ (2.12s)
2025-12-19 06:46:38 [DEBUG] ⏱️  Started: JEC:fundamentals
2025-12-19 06:46:38 [DEBUG]   -> Fetching fundamentals from FMP API...
2025-12-19 06:46:42 [DEBUG] ✅ Completed: JEC:fundamentals (took 4.27s)
2025-12-19 06:46:42 [DEBUG]   Fundamentals: ✓ (4.27s)
2025-12-19 06:46:42 [DEBUG] ⏱️  Started: JEC:analyst
2025-12-19 06:46:47 [DEBUG] ✅ Completed: JEC:analyst (took 4.57s)
2025-12-19 06:46:47 [DEBUG]   Analyst recs: ✓ (4.57s)
2025-12-19 06:46:48 [DEBUG] ⏱️  Started: JEC:news
2025-12-19 06:46:50 [DEBUG] ✅ Completed: JEC:news (took 2.75s)
2025-12-19 06:46:50 [DEBUG]   News: 0 items (2.75s)
2025-12-19 06:46:51 [INFO]   Total time for JEC: 15.71s
2025-12-19 06:46:51 [INFO] 
2025-12-19 06:46:51 [INFO] [63/65] Processing ABBV...
2025-12-19 06:46:51 [DEBUG] ⏱️  Started: ABBV:price_data
2025-12-19 06:46:53 [DEBUG] ✅ Completed: ABBV:price_data (took 1.97s)
2025-12-19 06:46:53 [DEBUG]   Price data: ✓ (1.97s)
2025-12-19 06:46:53 [DEBUG] ⏱️  Started: ABBV:fundamentals
2025-12-19 06:46:53 [DEBUG]   -> Fetching fundamentals from FMP API...
2025-12-19 06:46:58 [DEBUG] ✅ Completed: ABBV:fundamentals (took 4.42s)
2025-12-19 06:46:58 [DEBUG]   Fundamentals: ✓ (4.42s)
2025-12-19 06:46:58 [DEBUG] ⏱️  Started: ABBV:analyst
2025-12-19 06:47:01 [DEBUG] ✅ Completed: ABBV:analyst (took 3.16s)
2025-12-19 06:47:01 [DEBUG]   Analyst recs: ✓ (3.16s)
2025-12-19 06:47:02 [DEBUG] ⏱️  Started: ABBV:news
2025-12-19 06:47:02 [DEBUG] ✅ Completed: ABBV:news (took 0.62s)
2025-12-19 06:47:02 [DEBUG]   News: 10 items (0.62s)
2025-12-19 06:47:02 [DEBUG] ⏱️  Started: ABBV:sentiment
2025-12-19 06:47:04 [DEBUG] ✅ Completed: ABBV:sentiment (took 1.56s)
2025-12-19 06:47:04 [DEBUG]   Sentiment: 10 items classified (1.56s)
2025-12-19 06:47:05 [INFO]   Total time for ABBV: 14.24s
2025-12-19 06:47:05 [INFO] 
2025-12-19 06:47:05 [INFO] [64/65] Processing CMI...
2025-12-19 06:47:05 [DEBUG] ⏱️  Started: CMI:price_data
2025-12-19 06:47:07 [DEBUG] ✅ Completed: CMI:price_data (took 1.99s)
2025-12-19 06:47:07 [DEBUG]   Price data: ✓ (1.99s)
2025-12-19 06:47:08 [DEBUG] ⏱️  Started: CMI:fundamentals
2025-12-19 06:47:08 [DEBUG]   -> Fetching fundamentals from FMP API...
2025-12-19 06:47:12 [DEBUG] ✅ Completed: CMI:fundamentals (took 4.34s)
2025-12-19 06:47:12 [DEBUG]   Fundamentals: ✓ (4.34s)
2025-12-19 06:47:12 [DEBUG] ⏱️  Started: CMI:analyst
2025-12-19 06:47:15 [DEBUG] ✅ Completed: CMI:analyst (took 2.66s)
2025-12-19 06:47:15 [DEBUG]   Analyst recs: ✓ (2.66s)
2025-12-19 06:47:16 [DEBUG] ⏱️  Started: CMI:news
2025-12-19 06:47:16 [DEBUG] ✅ Completed: CMI:news (took 0.66s)
2025-12-19 06:47:16 [DEBUG]   News: 10 items (0.66s)
2025-12-19 06:47:16 [DEBUG] ⏱️  Started: CMI:sentiment
2025-12-19 06:47:18 [DEBUG] ✅ Completed: CMI:sentiment (took 1.46s)
2025-12-19 06:47:18 [DEBUG]   Sentiment: 10 items classified (1.46s)
2025-12-19 06:47:19 [INFO]   Total time for CMI: 13.61s
2025-12-19 06:47:19 [INFO] 
2025-12-19 06:47:19 [INFO] [65/65] Processing PG...
2025-12-19 06:47:19 [DEBUG] ⏱️  Started: PG:price_data
2025-12-19 06:47:21 [DEBUG] ✅ Completed: PG:price_data (took 1.90s)
2025-12-19 06:47:21 [DEBUG]   Price data: ✓ (1.90s)
2025-12-19 06:47:21 [DEBUG] ⏱️  Started: PG:fundamentals
2025-12-19 06:47:21 [DEBUG]   -> Fetching fundamentals from FMP API...
2025-12-19 06:47:25 [DEBUG] ✅ Completed: PG:fundamentals (took 4.37s)
2025-12-19 06:47:25 [DEBUG]   Fundamentals: ✓ (4.37s)
2025-12-19 06:47:26 [DEBUG] ⏱️  Started: PG:analyst
2025-12-19 06:47:29 [DEBUG] ✅ Completed: PG:analyst (took 2.92s)
2025-12-19 06:47:29 [DEBUG]   Analyst recs: ✓ (2.92s)
2025-12-19 06:47:29 [DEBUG] ⏱️  Started: PG:news
2025-12-19 06:47:30 [DEBUG] ✅ Completed: PG:news (took 0.63s)
2025-12-19 06:47:30 [DEBUG]   News: 10 items (0.63s)
2025-12-19 06:47:30 [DEBUG] ⏱️  Started: PG:sentiment
2025-12-19 06:47:32 [DEBUG] ✅ Completed: PG:sentiment (took 1.55s)
2025-12-19 06:47:32 [DEBUG]   Sentiment: 10 items classified (1.55s)
2025-12-19 06:47:33 [INFO]   Total time for PG: 13.88s
2025-12-19 06:47:33 [INFO] 
2025-12-19 06:47:33 [INFO] ================================================================================
2025-12-19 06:47:33 [INFO] DATA FETCHING SUMMARY
2025-12-19 06:47:33 [INFO] ================================================================================
2025-12-19 06:47:33 [INFO] Total tickers processed: 65
2025-12-19 06:47:33 [INFO] Total time: 933.38s (15.6 minutes)
2025-12-19 06:47:33 [INFO] Average time per ticker: 14.36s
2025-12-19 06:47:33 [INFO] 
2025-12-19 06:47:33 [INFO] Slowest tickers:
2025-12-19 06:47:33 [INFO]   FB: 18.60s
2025-12-19 06:47:33 [INFO]   CSCO: 16.94s
2025-12-19 06:47:33 [INFO]   KO: 15.84s
2025-12-19 06:47:33 [INFO]   MCD: 15.72s
2025-12-19 06:47:33 [INFO]   JEC: 15.71s
2025-12-19 06:47:33 [INFO]   CNC: 15.55s
2025-12-19 06:47:33 [INFO]   AAPL: 15.14s
2025-12-19 06:47:33 [INFO]   SNAP: 15.07s
2025-12-19 06:47:33 [INFO]   LRCX: 15.04s
2025-12-19 06:47:33 [INFO]   UPS: 15.04s
2025-12-19 06:47:33 [INFO] ================================================================================
2025-12-19 06:47:33 [DEBUG] ⏱️  Started: write_output_file
2025-12-19 06:47:33 [DEBUG] ✅ Completed: write_output_file (took 0.01s)
2025-12-19 06:47:33 [INFO] 
2025-12-19 06:47:33 [INFO] ✓ Fetched data for 65 tickers -> data\stock_data.json
2025-12-19 06:47:33 [INFO]   File write time: 0.01s
2025-12-19 06:47:33 [INFO] 
2025-12-19 06:47:33 [INFO] ================================================================================
2025-12-19 06:47:33 [INFO] DATA FETCHING COMPLETED
2025-12-19 06:47:33 [INFO] ================================================================================
